    1 0.000000000 24.20.126.47 → 192.168.1.20 TCP 60 62537 → 1989 [ACK] Seq=1 Ack=1 Win=2048 Len=0
    2 0.739866751 192.168.1.20 → 24.20.126.47 TCP 150 1989 → 62537 [PSH, ACK] Seq=1 Ack=1 Win=314 Len=96
    3 0.740708114 24.20.126.47 → 192.168.1.20 TCP 150 62537 → 1989 [PSH, ACK] Seq=1 Ack=97 Win=2048 Len=96
    4 0.740751109 24.20.126.47 → 192.168.1.20 TCP 118 62537 → 1989 [PSH, ACK] Seq=97 Ack=97 Win=2048 Len=64
    5 0.740812875 192.168.1.20 → 24.20.126.47 TCP 54 1989 → 62537 [ACK] Seq=97 Ack=161 Win=314 Len=0
    6 0.740909740 192.168.1.20 → 24.20.126.47 TCP 102 1989 → 62537 [PSH, ACK] Seq=97 Ack=161 Win=314 Len=48
    7 0.781432500 24.20.126.47 → 192.168.1.20 TCP 60 62537 → 1989 [ACK] Seq=161 Ack=145 Win=2047 Len=0
    8 1.245366572 192.168.1.20 → 24.20.126.47 TCP 150 1989 → 62537 [PSH, ACK] Seq=145 Ack=161 Win=314 Len=96
    9 1.285736162 24.20.126.47 → 192.168.1.20 TCP 60 62537 → 1989 [ACK] Seq=161 Ack=241 Win=2047 Len=0
   10 1.749771228 192.168.1.20 → 24.20.126.47 TCP 150 1989 → 62537 [PSH, ACK] Seq=241 Ack=161 Win=314 Len=96
   11 1.790592972 24.20.126.47 → 192.168.1.20 TCP 60 62537 → 1989 [ACK] Seq=161 Ack=337 Win=2053 Len=0
   12 2.253813699 192.168.1.20 → 24.20.126.47 TCP 150 1989 → 62537 [PSH, ACK] Seq=337 Ack=161 Win=314 Len=96
   13 2.294618729 24.20.126.47 → 192.168.1.20 TCP 60 62537 → 1989 [ACK] Seq=161 Ack=433 Win=2052 Len=0
   14 2.757678786 192.168.1.20 → 24.20.126.47 TCP 150 1989 → 62537 [PSH, ACK] Seq=433 Ack=161 Win=314 Len=96
   15 2.798574060 24.20.126.47 → 192.168.1.20 TCP 60 62537 → 1989 [ACK] Seq=161 Ack=529 Win=2052 Len=0
   16 3.261772376 192.168.1.20 → 24.20.126.47 TCP 150 1989 → 62537 [PSH, ACK] Seq=529 Ack=161 Win=314 Len=96
   17 3.303431747 24.20.126.47 → 192.168.1.20 TCP 60 62537 → 1989 [ACK] Seq=161 Ack=625 Win=2052 Len=0
   18 3.765539933 192.168.1.20 → 24.20.126.47 TCP 150 1989 → 62537 [PSH, ACK] Seq=625 Ack=161 Win=314 Len=96
   19 3.806184988 24.20.126.47 → 192.168.1.20 TCP 60 62537 → 1989 [ACK] Seq=161 Ack=721 Win=2051 Len=0
   20 4.269769597 192.168.1.20 → 24.20.126.47 TCP 150 1989 → 62537 [PSH, ACK] Seq=721 Ack=161 Win=314 Len=96
   21 4.310661669 24.20.126.47 → 192.168.1.20 TCP 60 62537 → 1989 [ACK] Seq=161 Ack=817 Win=2051 Len=0
   22 4.773806391 192.168.1.20 → 24.20.126.47 TCP 150 1989 → 62537 [PSH, ACK] Seq=817 Ack=161 Win=314 Len=96
   23 4.813994430 24.20.126.47 → 192.168.1.20 TCP 60 62537 → 1989 [ACK] Seq=161 Ack=913 Win=2050 Len=0
   24 5.003339789 192.168.1.20 → 24.20.126.47 TCP 230 1989 → 62537 [PSH, ACK] Seq=913 Ack=161 Win=314 Len=176
   25 5.044166982 24.20.126.47 → 192.168.1.20 TCP 60 62537 → 1989 [ACK] Seq=161 Ack=1089 Win=2050 Len=0
   26 5.277778924 192.168.1.20 → 24.20.126.47 TCP 150 1989 → 62537 [PSH, ACK] Seq=1089 Ack=161 Win=314 Len=96
   27 5.318572233 24.20.126.47 → 192.168.1.20 TCP 60 62537 → 1989 [ACK] Seq=161 Ack=1185 Win=2049 Len=0
   28 5.781757062 192.168.1.20 → 24.20.126.47 TCP 150 1989 → 62537 [PSH, ACK] Seq=1185 Ack=161 Win=314 Len=96
   29 5.822665389 24.20.126.47 → 192.168.1.20 TCP 60 62537 → 1989 [ACK] Seq=161 Ack=1281 Win=2049 Len=0
   30 6.285819663 192.168.1.20 → 24.20.126.47 TCP 150 1989 → 62537 [PSH, ACK] Seq=1281 Ack=161 Win=314 Len=96
   31 6.326663440 24.20.126.47 → 192.168.1.20 TCP 60 62537 → 1989 [ACK] Seq=161 Ack=1377 Win=2049 Len=0
   32 6.789708204 192.168.1.20 → 24.20.126.47 TCP 150 1989 → 62537 [PSH, ACK] Seq=1377 Ack=161 Win=314 Len=96
   33 6.830120905 24.20.126.47 → 192.168.1.20 TCP 60 62537 → 1989 [ACK] Seq=161 Ack=1473 Win=2048 Len=0
   34 7.293779979 192.168.1.20 → 24.20.126.47 TCP 150 1989 → 62537 [PSH, ACK] Seq=1473 Ack=161 Win=314 Len=96
   35 7.334172811 24.20.126.47 → 192.168.1.20 TCP 60 62537 → 1989 [ACK] Seq=161 Ack=1569 Win=2048 Len=0
   36 7.514274171  192.168.1.1 → 192.168.1.255 TiVoConnect 219 Discovery Beacon ReadyDLNA: R6250 (uuid:4d696e69-444c-164e-9d41-00000000c0be)
   37 7.797729242 192.168.1.20 → 24.20.126.47 TCP 150 1989 → 62537 [PSH, ACK] Seq=1569 Ack=161 Win=314 Len=96
   38 7.838396171 24.20.126.47 → 192.168.1.20 TCP 60 62537 → 1989 [ACK] Seq=161 Ack=1665 Win=2047 Len=0
   39 8.301780432 192.168.1.20 → 24.20.126.47 TCP 150 1989 → 62537 [PSH, ACK] Seq=1665 Ack=161 Win=314 Len=96
   40 8.342627434 24.20.126.47 → 192.168.1.20 TCP 60 62537 → 1989 [ACK] Seq=161 Ack=1761 Win=2047 Len=0
   41 8.805710594 192.168.1.20 → 24.20.126.47 TCP 150 1989 → 62537 [PSH, ACK] Seq=1761 Ack=161 Win=314 Len=96
   42 8.847115166 24.20.126.47 → 192.168.1.20 TCP 60 62537 → 1989 [ACK] Seq=161 Ack=1857 Win=2053 Len=0
   43 9.309788020 192.168.1.20 → 24.20.126.47 TCP 150 1989 → 62537 [PSH, ACK] Seq=1857 Ack=161 Win=314 Len=96
   44 9.350470118 24.20.126.47 → 192.168.1.20 TCP 60 62537 → 1989 [ACK] Seq=161 Ack=1953 Win=2052 Len=0
   45 9.813800061 192.168.1.20 → 24.20.126.47 TCP 150 1989 → 62537 [PSH, ACK] Seq=1953 Ack=161 Win=314 Len=96
   46 9.854415931 24.20.126.47 → 192.168.1.20 TCP 60 62537 → 1989 [ACK] Seq=161 Ack=2049 Win=2052 Len=0
