    1 0.000000000 24.20.126.47 → 192.168.1.20 TCP 60 62537 → 1989 [ACK] Seq=1 Ack=1 Win=2049 Len=0
    2 0.260549182  192.168.1.1 → 239.255.255.250 IGMPv2 60 Membership Report group 239.255.255.250
    3 0.282155137 192.168.1.20 → 24.20.126.47 TCP 230 1989 → 62537 [PSH, ACK] Seq=1 Ack=1 Win=314 Len=176
    4 0.323001530 24.20.126.47 → 192.168.1.20 TCP 60 62537 → 1989 [ACK] Seq=1 Ack=177 Win=2049 Len=0
    5 0.724268741 192.168.1.20 → 24.20.126.47 TCP 150 1989 → 62537 [PSH, ACK] Seq=177 Ack=1 Win=314 Len=96
    6 0.765347441 24.20.126.47 → 192.168.1.20 TCP 60 62537 → 1989 [ACK] Seq=1 Ack=273 Win=2048 Len=0
    7 1.228195875 192.168.1.20 → 24.20.126.47 TCP 150 1989 → 62537 [PSH, ACK] Seq=273 Ack=1 Win=314 Len=96
    8 1.268950276 24.20.126.47 → 192.168.1.20 TCP 60 62537 → 1989 [ACK] Seq=1 Ack=369 Win=2048 Len=0
    9 1.732233147 192.168.1.20 → 24.20.126.47 TCP 150 1989 → 62537 [PSH, ACK] Seq=369 Ack=1 Win=314 Len=96
   10 1.772923267 24.20.126.47 → 192.168.1.20 TCP 60 62537 → 1989 [ACK] Seq=1 Ack=465 Win=2048 Len=0
   11 1.896397424  192.168.1.3 → 192.168.1.20 ALLJOYN-ARDP 78 flags: ACK NUL SEQ: 4239672071 ACK:  959750365
   12 1.896847945 192.168.1.20 → 192.168.1.3  ALLJOYN-ARDP 78 flags: ACK SEQ:  959750366 ACK: 4239672070
   13 2.236217022 192.168.1.20 → 24.20.126.47 TCP 150 1989 → 62537 [PSH, ACK] Seq=465 Ack=1 Win=314 Len=96
   14 2.277624262 24.20.126.47 → 192.168.1.20 TCP 60 62537 → 1989 [ACK] Seq=1 Ack=561 Win=2047 Len=0
   15 2.740209846 192.168.1.20 → 24.20.126.47 TCP 150 1989 → 62537 [PSH, ACK] Seq=561 Ack=1 Win=314 Len=96
   16 2.780739907 24.20.126.47 → 192.168.1.20 TCP 60 62537 → 1989 [ACK] Seq=1 Ack=657 Win=2053 Len=0
   17 2.888126689  192.168.1.3 → 192.168.1.20 UDP 78 59146 → 37388 Len=36
   18 2.888541967 192.168.1.20 → 192.168.1.3  UDP 78 37388 → 59146 Len=36
   19 3.244196524 192.168.1.20 → 24.20.126.47 TCP 150 1989 → 62537 [PSH, ACK] Seq=657 Ack=1 Win=314 Len=96
   20 3.285762909 24.20.126.47 → 192.168.1.20 TCP 60 62537 → 1989 [ACK] Seq=1 Ack=753 Win=2052 Len=0
   21 3.748137907 192.168.1.20 → 24.20.126.47 TCP 150 1989 → 62537 [PSH, ACK] Seq=753 Ack=1 Win=314 Len=96
   22 3.788836712 24.20.126.47 → 192.168.1.20 TCP 60 62537 → 1989 [ACK] Seq=1 Ack=849 Win=2052 Len=0
   23 4.252218733 192.168.1.20 → 24.20.126.47 TCP 150 1989 → 62537 [PSH, ACK] Seq=849 Ack=1 Win=314 Len=96
   24 4.296020592 24.20.126.47 → 192.168.1.20 TCP 60 62537 → 1989 [ACK] Seq=1 Ack=945 Win=2052 Len=0
   25 4.601583486 24.20.126.47 → 192.168.1.20 TCP 118 62537 → 1989 [PSH, ACK] Seq=1 Ack=945 Win=2052 Len=64
   26 4.640772695 192.168.1.20 → 24.20.126.47 TCP 54 1989 → 62537 [ACK] Seq=945 Ack=65 Win=314 Len=0
   27 4.756306463 192.168.1.20 → 24.20.126.47 TCP 150 1989 → 62537 [PSH, ACK] Seq=945 Ack=65 Win=314 Len=96
   28 4.797246676 24.20.126.47 → 192.168.1.20 TCP 60 62537 → 1989 [ACK] Seq=65 Ack=1041 Win=2051 Len=0
   29 5.260199512 192.168.1.20 → 24.20.126.47 TCP 150 1989 → 62537 [PSH, ACK] Seq=1041 Ack=65 Win=314 Len=96
   30 5.300314315 24.20.126.47 → 192.168.1.20 TCP 60 62537 → 1989 [ACK] Seq=65 Ack=1137 Win=2051 Len=0
   31 5.640493188      0.0.0.0 → 224.0.0.1    IGMPv2 60 Membership Query, general
   32 5.640586935           :: → ff02::1      ICMPv6 86 Multicast Listener Query
   33 5.764232906 192.168.1.20 → 24.20.126.47 TCP 150 1989 → 62537 [PSH, ACK] Seq=1137 Ack=65 Win=314 Len=96
   34 5.809866163 24.20.126.47 → 192.168.1.20 TCP 60 62537 → 1989 [ACK] Seq=65 Ack=1233 Win=2050 Len=0
   35 6.017856116 24.20.126.47 → 192.168.1.20 TCP 118 62537 → 1989 [PSH, ACK] Seq=65 Ack=1233 Win=2050 Len=64
   36 6.017938719 192.168.1.20 → 24.20.126.47 TCP 54 1989 → 62537 [ACK] Seq=1233 Ack=129 Win=314 Len=0
   37 6.020705399 192.168.1.20 → 24.20.126.47 TCP 1462 1989 → 62537 [PSH, ACK] Seq=1233 Ack=129 Win=314 Len=1408
   38 6.025367277 24.20.126.47 → 192.168.1.20 TCP 150 62537 → 1989 [PSH, ACK] Seq=129 Ack=2641 Win=2053 Len=96
   39 6.025445204 24.20.126.47 → 192.168.1.20 TCP 118 62537 → 1989 [PSH, ACK] Seq=225 Ack=2641 Win=2053 Len=64
   40 6.025569574 192.168.1.20 → 24.20.126.47 TCP 54 1989 → 62537 [ACK] Seq=2641 Ack=289 Win=314 Len=0
   41 6.025693007 192.168.1.20 → 24.20.126.47 TCP 102 1989 → 62537 [PSH, ACK] Seq=2641 Ack=289 Win=314 Len=48
   42 6.066261423 24.20.126.47 → 192.168.1.20 TCP 60 62537 → 1989 [ACK] Seq=289 Ack=2689 Win=2052 Len=0
   43 6.297438307 192.168.1.16 → 224.0.0.251  IGMPv2 60 Membership Report group 224.0.0.251
   44 6.910646382 24.20.126.47 → 192.168.1.20 TCP 118 62537 → 1989 [PSH, ACK] Seq=289 Ack=2689 Win=2052 Len=64
   45 6.911931477 192.168.1.20 → 24.20.126.47 TCP 150 1989 → 62537 [PSH, ACK] Seq=2689 Ack=353 Win=314 Len=96
   46 6.953249846 24.20.126.47 → 192.168.1.20 TCP 60 62537 → 1989 [ACK] Seq=353 Ack=2785 Win=2052 Len=0
   47 6.959395568 24.20.126.47 → 192.168.1.20 TCP 118 62537 → 1989 [PSH, ACK] Seq=353 Ack=2785 Win=2052 Len=64
   48 6.960454118 192.168.1.20 → 24.20.126.47 TCP 150 1989 → 62537 [PSH, ACK] Seq=2785 Ack=417 Win=314 Len=96
   49 6.975902795 24.20.126.47 → 192.168.1.20 TCP 118 62537 → 1989 [PSH, ACK] Seq=417 Ack=2881 Win=2052 Len=64
   50 6.976915282 192.168.1.20 → 24.20.126.47 TCP 150 1989 → 62537 [PSH, ACK] Seq=2881 Ack=481 Win=314 Len=96
   51 7.014629016 24.20.126.47 → 192.168.1.20 TCP 118 62537 → 1989 [PSH, ACK] Seq=481 Ack=2977 Win=2051 Len=64
   52 7.015647226 192.168.1.20 → 24.20.126.47 TCP 150 1989 → 62537 [PSH, ACK] Seq=2977 Ack=545 Win=314 Len=96
   53 7.032866413 24.20.126.47 → 192.168.1.20 TCP 118 62537 → 1989 [PSH, ACK] Seq=545 Ack=3073 Win=2051 Len=64
   54 7.033880198 192.168.1.20 → 24.20.126.47 TCP 150 1989 → 62537 [PSH, ACK] Seq=3073 Ack=609 Win=314 Len=96
   55 7.074912221 24.20.126.47 → 192.168.1.20 TCP 60 62537 → 1989 [ACK] Seq=609 Ack=3169 Win=2051 Len=0
   56 7.076463866 24.20.126.47 → 192.168.1.20 TCP 118 62537 → 1989 [PSH, ACK] Seq=609 Ack=3169 Win=2051 Len=64
   57 7.077519394 192.168.1.20 → 24.20.126.47 TCP 150 1989 → 62537 [PSH, ACK] Seq=3169 Ack=673 Win=314 Len=96
   58 7.118184082 24.20.126.47 → 192.168.1.20 TCP 60 62537 → 1989 [ACK] Seq=673 Ack=3265 Win=2050 Len=0
   59 7.335234941 24.20.126.47 → 192.168.1.20 TCP 118 62537 → 1989 [PSH, ACK] Seq=673 Ack=3265 Win=2050 Len=64
   60 7.336156247 192.168.1.20 → 24.20.126.47 TCP 150 1989 → 62537 [PSH, ACK] Seq=3265 Ack=737 Win=314 Len=96
   61 7.346297526 192.168.1.20 → 192.168.1.3  ALLJOYN 225 Message 0000000207: 'Signal emission' Chat (s)
   62 7.346724337 192.168.1.20 → 192.168.1.3  UDP 225 37388 → 59146 Len=183
   63 7.347132469 192.168.1.20 → 192.168.1.3  UDP 225 37388 → 48830 Len=183
   64 7.377783925 24.20.126.47 → 192.168.1.20 TCP 60 62537 → 1989 [ACK] Seq=737 Ack=3361 Win=2050 Len=0
   65 7.456647867  192.168.1.3 → 192.168.1.20 UDP 78 59146 → 37388 Len=36
   66 7.456710004  192.168.1.3 → 192.168.1.20 UDP 78 48830 → 37388 Len=36
   67 7.460270298  192.168.1.3 → 192.168.1.20 ALLJOYN-ARDP 78 flags: ACK SEQ: 4239672071 ACK:  959750366
   68 7.624060922 fe80::1080:5a6c:f071:7e63 → ff02::2      ICMPv6 70 Router Solicitation from b4:9c:df:2c:2c:e9
   69 7.683486898  192.168.1.3 → 192.168.1.20 ALLJOYN-ARDP 78 flags: ACK SEQ: 4239672071 ACK:  959750366
   70 7.914196992  192.168.1.7 → 224.0.0.251  MDNS 154 Standard query 0x0000 PTR _homekit._tcp.local, "QU" question PTR _companion-link._tcp.local, "QU" question PTR _sleep-proxy._udp.local, "QU" question OPT
   71 7.916465321 fe80::1080:5a6c:f071:7e63 → ff02::fb     MDNS 174 Standard query 0x0000 PTR _homekit._tcp.local, "QU" question PTR _companion-link._tcp.local, "QU" question PTR _sleep-proxy._udp.local, "QU" question OPT
   72 8.086896144 24.20.126.47 → 192.168.1.20 TCP 118 62537 → 1989 [PSH, ACK] Seq=737 Ack=3361 Win=2050 Len=64
   73 8.088157842 192.168.1.20 → 24.20.126.47 TCP 150 1989 → 62537 [PSH, ACK] Seq=3361 Ack=801 Win=314 Len=96
   74 8.128568926 24.20.126.47 → 192.168.1.20 TCP 60 62537 → 1989 [ACK] Seq=801 Ack=3457 Win=2049 Len=0
   75 8.138331717 24.20.126.47 → 192.168.1.20 TCP 118 62537 → 1989 [PSH, ACK] Seq=801 Ack=3457 Win=2049 Len=64
   76 8.139394501 192.168.1.20 → 24.20.126.47 TCP 150 1989 → 62537 [PSH, ACK] Seq=3457 Ack=865 Win=314 Len=96
   77 8.179070154 24.20.126.47 → 192.168.1.20 TCP 60 62537 → 1989 [ACK] Seq=865 Ack=3553 Win=2049 Len=0
   78 8.186821605 24.20.126.47 → 192.168.1.20 TCP 118 62537 → 1989 [PSH, ACK] Seq=865 Ack=3553 Win=2049 Len=64
   79 8.187830565 192.168.1.20 → 24.20.126.47 TCP 150 1989 → 62537 [PSH, ACK] Seq=3553 Ack=929 Win=314 Len=96
   80 8.193864230 24.20.126.47 → 192.168.1.20 TCP 118 62537 → 1989 [PSH, ACK] Seq=929 Ack=3649 Win=2049 Len=64
   81 8.194858297 192.168.1.20 → 24.20.126.47 TCP 150 1989 → 62537 [PSH, ACK] Seq=3649 Ack=993 Win=314 Len=96
   82 8.220360678 24.20.126.47 → 192.168.1.20 TCP 118 62537 → 1989 [PSH, ACK] Seq=993 Ack=3745 Win=2048 Len=64
   83 8.221394598 192.168.1.20 → 24.20.126.47 TCP 150 1989 → 62537 [PSH, ACK] Seq=3745 Ack=1057 Win=314 Len=96
   84 8.251518974 24.20.126.47 → 192.168.1.20 TCP 118 62537 → 1989 [PSH, ACK] Seq=1057 Ack=3841 Win=2048 Len=64
   85 8.252577303 192.168.1.20 → 24.20.126.47 TCP 150 1989 → 62537 [PSH, ACK] Seq=3841 Ack=1121 Win=314 Len=96
   86 8.293756491 24.20.126.47 → 192.168.1.20 TCP 60 62537 → 1989 [ACK] Seq=1121 Ack=3937 Win=2048 Len=0
   87 8.297241909 192.168.1.16 → 239.255.255.250 IGMPv2 60 Membership Report group 239.255.255.250
   88 8.368510594 24.20.126.47 → 192.168.1.20 TCP 118 62537 → 1989 [PSH, ACK] Seq=1121 Ack=3937 Win=2048 Len=64
   89 8.369623166 192.168.1.20 → 24.20.126.47 TCP 150 1989 → 62537 [PSH, ACK] Seq=3937 Ack=1185 Win=314 Len=96
   90 8.370352354 24.20.126.47 → 192.168.1.20 TCP 118 62537 → 1989 [PSH, ACK] Seq=1185 Ack=4033 Win=2047 Len=64
   91 8.371192827 192.168.1.20 → 24.20.126.47 TCP 150 1989 → 62537 [PSH, ACK] Seq=4033 Ack=1249 Win=314 Len=96
   92 8.412008381 24.20.126.47 → 192.168.1.20 TCP 60 62537 → 1989 [ACK] Seq=1249 Ack=4129 Win=2053 Len=0
   93 8.698315655 24.20.126.47 → 192.168.1.20 TCP 118 62537 → 1989 [PSH, ACK] Seq=1249 Ack=4129 Win=2053 Len=64
   94 8.699247823 192.168.1.20 → 24.20.126.47 TCP 150 1989 → 62537 [PSH, ACK] Seq=4129 Ack=1313 Win=314 Len=96
   95 8.710408021 192.168.1.20 → 192.168.1.3  ALLJOYN 227 Message 0000000208: 'Signal emission' Chat (s)
   96 8.710853746 192.168.1.20 → 192.168.1.3  UDP 227 37388 → 59146 Len=185
   97 8.711231589 192.168.1.20 → 192.168.1.3  UDP 227 37388 → 48830 Len=185
   98 8.739900844 24.20.126.47 → 192.168.1.20 TCP 60 62537 → 1989 [ACK] Seq=1313 Ack=4225 Win=2052 Len=0
   99 8.821712114  192.168.1.3 → 192.168.1.20 ALLJOYN-ARDP 78 flags: ACK SEQ: 4239672071 ACK:  959750367
  100 8.821774903  192.168.1.3 → 192.168.1.20 UDP 78 59146 → 37388 Len=36
  101 8.824538867  192.168.1.3 → 192.168.1.20 UDP 78 48830 → 37388 Len=36
  102 8.929199696  192.168.1.7 → 224.0.0.251  MDNS 154 Standard query 0x0000 PTR _homekit._tcp.local, "QM" question PTR _companion-link._tcp.local, "QM" question PTR _sleep-proxy._udp.local, "QM" question OPT
  103 8.929309468 fe80::1080:5a6c:f071:7e63 → ff02::fb     MDNS 174 Standard query 0x0000 PTR _homekit._tcp.local, "QM" question PTR _companion-link._tcp.local, "QM" question PTR _sleep-proxy._udp.local, "QM" question OPT
  104 9.032026256  192.168.1.3 → 192.168.1.20 ALLJOYN-ARDP 78 flags: ACK SEQ: 4239672071 ACK:  959750367
  105 9.305406470 24.20.126.47 → 192.168.1.20 TCP 118 62537 → 1989 [PSH, ACK] Seq=1313 Ack=4225 Win=2052 Len=64
  106 9.306470672 192.168.1.20 → 24.20.126.47 TCP 150 1989 → 62537 [PSH, ACK] Seq=4225 Ack=1377 Win=314 Len=96
  107 9.347511735 24.20.126.47 → 192.168.1.20 TCP 60 62537 → 1989 [ACK] Seq=1377 Ack=4321 Win=2052 Len=0
  108 9.352730799 24.20.126.47 → 192.168.1.20 TCP 118 62537 → 1989 [PSH, ACK] Seq=1377 Ack=4321 Win=2052 Len=64
  109 9.353726505 192.168.1.20 → 24.20.126.47 TCP 150 1989 → 62537 [PSH, ACK] Seq=4321 Ack=1441 Win=314 Len=96
  110 9.370722386 24.20.126.47 → 192.168.1.20 TCP 118 62537 → 1989 [PSH, ACK] Seq=1441 Ack=4417 Win=2052 Len=64
  111 9.371751680 192.168.1.20 → 24.20.126.47 TCP 150 1989 → 62537 [PSH, ACK] Seq=4417 Ack=1505 Win=314 Len=96
  112 9.412934413 24.20.126.47 → 192.168.1.20 TCP 60 62537 → 1989 [ACK] Seq=1505 Ack=4513 Win=2051 Len=0
  113 9.417397166 24.20.126.47 → 192.168.1.20 TCP 118 62537 → 1989 [PSH, ACK] Seq=1505 Ack=4513 Win=2051 Len=64
  114 9.418435135 192.168.1.20 → 24.20.126.47 TCP 150 1989 → 62537 [PSH, ACK] Seq=4513 Ack=1569 Win=314 Len=96
  115 9.436215320 24.20.126.47 → 192.168.1.20 TCP 118 62537 → 1989 [PSH, ACK] Seq=1569 Ack=4609 Win=2051 Len=64
  116 9.437266617 192.168.1.20 → 24.20.126.47 TCP 150 1989 → 62537 [PSH, ACK] Seq=4609 Ack=1633 Win=314 Len=96
  117 9.477360335 24.20.126.47 → 192.168.1.20 TCP 60 62537 → 1989 [ACK] Seq=1633 Ack=4705 Win=2050 Len=0
  118 9.494064070 24.20.126.47 → 192.168.1.20 TCP 118 62537 → 1989 [PSH, ACK] Seq=1633 Ack=4705 Win=2050 Len=64
  119 9.495100020 192.168.1.20 → 24.20.126.47 TCP 150 1989 → 62537 [PSH, ACK] Seq=4705 Ack=1697 Win=314 Len=96
  120 9.536974732 24.20.126.47 → 192.168.1.20 TCP 60 62537 → 1989 [ACK] Seq=1697 Ack=4801 Win=2050 Len=0
  121 9.595163326 24.20.126.47 → 192.168.1.20 TCP 118 62537 → 1989 [PSH, ACK] Seq=1697 Ack=4801 Win=2050 Len=64
  122 9.596202598 192.168.1.20 → 24.20.126.47 TCP 150 1989 → 62537 [PSH, ACK] Seq=4801 Ack=1761 Win=314 Len=96
  123 9.612123376 24.20.126.47 → 192.168.1.20 TCP 118 62537 → 1989 [PSH, ACK] Seq=1761 Ack=4897 Win=2050 Len=64
  124 9.613195009 192.168.1.20 → 24.20.126.47 TCP 150 1989 → 62537 [PSH, ACK] Seq=4897 Ack=1825 Win=314 Len=96
  125 9.654080443 24.20.126.47 → 192.168.1.20 TCP 60 62537 → 1989 [ACK] Seq=1825 Ack=4993 Win=2049 Len=0
  126 9.688296445 24.20.126.47 → 192.168.1.20 TCP 118 62537 → 1989 [PSH, ACK] Seq=1825 Ack=4993 Win=2049 Len=64
  127 9.689321583 192.168.1.20 → 24.20.126.47 TCP 150 1989 → 62537 [PSH, ACK] Seq=4993 Ack=1889 Win=314 Len=96
  128 9.730338046 24.20.126.47 → 192.168.1.20 TCP 60 62537 → 1989 [ACK] Seq=1889 Ack=5089 Win=2049 Len=0
