    1 0.000000000 24.20.126.47 → 192.168.1.20 TCP 118 62537 → 1989 [PSH, ACK] Seq=1 Ack=1 Win=2053 Len=64
    2 0.001172165 192.168.1.20 → 24.20.126.47 TCP 150 1989 → 62537 [PSH, ACK] Seq=1 Ack=65 Win=314 Len=96
    3 0.041919521 24.20.126.47 → 192.168.1.20 TCP 60 62537 → 1989 [ACK] Seq=65 Ack=97 Win=2052 Len=0
    4 0.062923635 24.20.126.47 → 192.168.1.20 TCP 118 62537 → 1989 [PSH, ACK] Seq=65 Ack=97 Win=2052 Len=64
    5 0.063742684 192.168.1.20 → 24.20.126.47 TCP 150 1989 → 62537 [PSH, ACK] Seq=97 Ack=129 Win=314 Len=96
    6 0.073846244 24.20.126.47 → 192.168.1.20 TCP 118 62537 → 1989 [PSH, ACK] Seq=129 Ack=193 Win=2052 Len=64
    7 0.074698672 192.168.1.20 → 24.20.126.47 TCP 150 1989 → 62537 [PSH, ACK] Seq=193 Ack=193 Win=314 Len=96
    8 0.105658864 24.20.126.47 → 192.168.1.20 TCP 118 62537 → 1989 [PSH, ACK] Seq=193 Ack=289 Win=2052 Len=64
    9 0.106506556 192.168.1.20 → 24.20.126.47 TCP 150 1989 → 62537 [PSH, ACK] Seq=289 Ack=257 Win=314 Len=96
   10 0.124212707 24.20.126.47 → 192.168.1.20 TCP 118 62537 → 1989 [PSH, ACK] Seq=257 Ack=385 Win=2051 Len=64
   11 0.125068056 192.168.1.20 → 24.20.126.47 TCP 150 1989 → 62537 [PSH, ACK] Seq=385 Ack=321 Win=314 Len=96
   12 0.150168431 24.20.126.47 → 192.168.1.20 TCP 118 62537 → 1989 [PSH, ACK] Seq=321 Ack=481 Win=2051 Len=64
   13 0.150980635 192.168.1.20 → 24.20.126.47 TCP 150 1989 → 62537 [PSH, ACK] Seq=481 Ack=385 Win=314 Len=96
   14 0.191291668 24.20.126.47 → 192.168.1.20 TCP 60 62537 → 1989 [ACK] Seq=385 Ack=577 Win=2050 Len=0
   15 0.269844766 24.20.126.47 → 192.168.1.20 TCP 118 62537 → 1989 [PSH, ACK] Seq=385 Ack=577 Win=2050 Len=64
   16 0.270736210 192.168.1.20 → 24.20.126.47 TCP 150 1989 → 62537 [PSH, ACK] Seq=577 Ack=449 Win=314 Len=96
   17 0.273356232 24.20.126.47 → 192.168.1.20 TCP 118 62537 → 1989 [PSH, ACK] Seq=449 Ack=673 Win=2050 Len=64
   18 0.274191181 192.168.1.20 → 24.20.126.47 TCP 150 1989 → 62537 [PSH, ACK] Seq=673 Ack=513 Win=314 Len=96
   19 0.314154517 24.20.126.47 → 192.168.1.20 TCP 60 62537 → 1989 [ACK] Seq=513 Ack=769 Win=2050 Len=0
   20 0.334505315 24.20.126.47 → 192.168.1.20 TCP 118 62537 → 1989 [PSH, ACK] Seq=513 Ack=769 Win=2050 Len=64
   21 0.335531493 192.168.1.20 → 24.20.126.47 TCP 150 1989 → 62537 [PSH, ACK] Seq=769 Ack=577 Win=314 Len=96
   22 0.376058298 24.20.126.47 → 192.168.1.20 TCP 60 62537 → 1989 [ACK] Seq=577 Ack=865 Win=2049 Len=0
   23 0.864873426 24.20.126.47 → 192.168.1.20 TCP 118 62537 → 1989 [PSH, ACK] Seq=577 Ack=865 Win=2049 Len=64
   24 0.865919112 192.168.1.20 → 24.20.126.47 TCP 150 1989 → 62537 [PSH, ACK] Seq=865 Ack=641 Win=314 Len=96
   25 0.895110267 192.168.1.20 → 192.168.1.3  ALLJOYN 228 Message 0000000617: 'Signal emission' Chat (s)
   26 0.895475508 192.168.1.20 → 192.168.1.3  UDP 228 37388 → 59146 Len=186
   27 0.896047330 192.168.1.20 → 192.168.1.3  UDP 228 37388 → 48830 Len=186
   28 0.896791251 192.168.1.20 → 192.168.1.2  UDP 228 37388 → 38990 Len=186
   29 0.897213695 192.168.1.20 → 192.168.1.2  ALLJOYN 228 Message 0000000617: 'Signal emission' Chat (s)
   30 0.897543581 192.168.1.20 → 192.168.1.4  UDP 228 37388 → 48618 Len=186
   31 0.897873215 192.168.1.20 → 192.168.1.4  ALLJOYN 228 Message 0000000617: 'Signal emission' Chat (s)
   32 0.907525008 24.20.126.47 → 192.168.1.20 TCP 60 62537 → 1989 [ACK] Seq=641 Ack=961 Win=2049 Len=0
   33 0.986808254 192.168.1.20 → 192.168.1.3  ALLJOYN-ARDP 78 flags: ACK NUL SEQ:  959768988 ACK: 4239697880
   34 0.992295200  192.168.1.3 → 192.168.1.20 ALLJOYN-ARDP 78 flags: ACK SEQ: 4239697881 ACK:  959768987
   35 1.004435074  192.168.1.3 → 192.168.1.20 UDP 78 48830 → 37388 Len=36
   36 1.005137349  192.168.1.2 → 192.168.1.20 UDP 78 38990 → 37388 Len=36
   37 1.005742637  192.168.1.2 → 192.168.1.20 ALLJOYN-ARDP 78 flags: ACK SEQ: 3553977248 ACK:   86639101
   38 1.008547110  192.168.1.3 → 192.168.1.20 UDP 78 59146 → 37388 Len=36
   39 1.012221297  192.168.1.4 → 192.168.1.20 UDP 78 48618 → 37388 Len=36
   40 1.012284617  192.168.1.4 → 192.168.1.20 ALLJOYN-ARDP 78 flags: ACK SEQ:   66284480 ACK: 3091424231
   41 1.138550088  192.168.1.3 → 192.168.1.20 UDP 78 48830 → 37388 Len=36
   42 1.140207506  192.168.1.4 → 192.168.1.20 UDP 78 48618 → 37388 Len=36
   43 1.223203567  192.168.1.3 → 192.168.1.20 ALLJOYN-ARDP 78 flags: ACK SEQ: 4239697881 ACK:  959768987
   44 1.241368871  192.168.1.2 → 192.168.1.20 ALLJOYN-ARDP 78 flags: ACK SEQ: 3553977248 ACK:   86639101
   45 1.242736423  192.168.1.4 → 192.168.1.20 ALLJOYN-ARDP 78 flags: ACK SEQ:   66284480 ACK: 3091424231
   46 1.624131378 24.20.126.47 → 192.168.1.20 TCP 118 62537 → 1989 [PSH, ACK] Seq=641 Ack=961 Win=2049 Len=64
   47 1.625450429 192.168.1.20 → 24.20.126.47 TCP 150 1989 → 62537 [PSH, ACK] Seq=961 Ack=705 Win=314 Len=96
   48 1.630617267 24.20.126.47 → 192.168.1.20 TCP 118 62537 → 1989 [PSH, ACK] Seq=705 Ack=1057 Win=2049 Len=64
   49 1.631635812 192.168.1.20 → 24.20.126.47 TCP 150 1989 → 62537 [PSH, ACK] Seq=1057 Ack=769 Win=314 Len=96
   50 1.658681146 24.20.126.47 → 192.168.1.20 TCP 118 62537 → 1989 [PSH, ACK] Seq=769 Ack=1153 Win=2048 Len=64
   51 1.659693292 192.168.1.20 → 24.20.126.47 TCP 150 1989 → 62537 [PSH, ACK] Seq=1153 Ack=833 Win=314 Len=96
   52 1.689056046 24.20.126.47 → 192.168.1.20 TCP 118 62537 → 1989 [PSH, ACK] Seq=833 Ack=1249 Win=2048 Len=64
   53 1.690081131 192.168.1.20 → 24.20.126.47 TCP 150 1989 → 62537 [PSH, ACK] Seq=1249 Ack=897 Win=314 Len=96
   54 1.731955353 24.20.126.47 → 192.168.1.20 TCP 60 62537 → 1989 [ACK] Seq=897 Ack=1345 Win=2047 Len=0
   55 1.773477517 24.20.126.47 → 192.168.1.20 TCP 118 62537 → 1989 [PSH, ACK] Seq=897 Ack=1345 Win=2047 Len=64
   56 1.774479155 192.168.1.20 → 24.20.126.47 TCP 150 1989 → 62537 [PSH, ACK] Seq=1345 Ack=961 Win=314 Len=96
   57 1.801012504 24.20.126.47 → 192.168.1.20 TCP 118 62537 → 1989 [PSH, ACK] Seq=961 Ack=1441 Win=2047 Len=64
   58 1.802048523 192.168.1.20 → 24.20.126.47 TCP 150 1989 → 62537 [PSH, ACK] Seq=1441 Ack=1025 Win=314 Len=96
   59 1.843032475 24.20.126.47 → 192.168.1.20 TCP 60 62537 → 1989 [ACK] Seq=1025 Ack=1537 Win=2053 Len=0
   60 1.899905724 24.20.126.47 → 192.168.1.20 TCP 118 62537 → 1989 [PSH, ACK] Seq=1025 Ack=1537 Win=2053 Len=64
   61 1.900924320 192.168.1.20 → 24.20.126.47 TCP 150 1989 → 62537 [PSH, ACK] Seq=1537 Ack=1089 Win=314 Len=96
   62 1.906637893 24.20.126.47 → 192.168.1.20 TCP 118 62537 → 1989 [PSH, ACK] Seq=1089 Ack=1633 Win=2052 Len=64
   63 1.907642052 192.168.1.20 → 24.20.126.47 TCP 150 1989 → 62537 [PSH, ACK] Seq=1633 Ack=1153 Win=314 Len=96
   64 1.930587956 24.20.126.47 → 192.168.1.20 TCP 118 62537 → 1989 [PSH, ACK] Seq=1153 Ack=1729 Win=2052 Len=64
   65 1.931570151 192.168.1.20 → 24.20.126.47 TCP 150 1989 → 62537 [PSH, ACK] Seq=1729 Ack=1217 Win=314 Len=96
   66 1.971573394 24.20.126.47 → 192.168.1.20 TCP 60 62537 → 1989 [ACK] Seq=1217 Ack=1825 Win=2052 Len=0
   67 1.978314673 24.20.126.47 → 192.168.1.20 TCP 118 62537 → 1989 [PSH, ACK] Seq=1217 Ack=1825 Win=2052 Len=64
   68 1.979298341 192.168.1.20 → 24.20.126.47 TCP 150 1989 → 62537 [PSH, ACK] Seq=1825 Ack=1281 Win=314 Len=96
   69 2.026294441 24.20.126.47 → 192.168.1.20 TCP 60 62537 → 1989 [ACK] Seq=1281 Ack=1921 Win=2051 Len=0
   70 2.472163346 24.20.126.47 → 192.168.1.20 TCP 118 62537 → 1989 [PSH, ACK] Seq=1281 Ack=1921 Win=2051 Len=64
   71 2.473191047 192.168.1.20 → 24.20.126.47 TCP 150 1989 → 62537 [PSH, ACK] Seq=1921 Ack=1345 Win=314 Len=96
   72 2.502496807 192.168.1.20 → 192.168.1.3  ALLJOYN 229 Message 0000000618: 'Signal emission' Chat (s)
   73 2.502911842 192.168.1.20 → 192.168.1.3  UDP 229 37388 → 59146 Len=187
   74 2.503311864 192.168.1.20 → 192.168.1.3  UDP 229 37388 → 48830 Len=187
   75 2.503665367 192.168.1.20 → 192.168.1.2  UDP 229 37388 → 38990 Len=187
   76 2.504028812 192.168.1.20 → 192.168.1.2  ALLJOYN 229 Message 0000000618: 'Signal emission' Chat (s)
   77 2.504394711 192.168.1.20 → 192.168.1.4  UDP 229 37388 → 48618 Len=187
   78 2.504764666 192.168.1.20 → 192.168.1.4  ALLJOYN 229 Message 0000000618: 'Signal emission' Chat (s)
   79 2.513429519 24.20.126.47 → 192.168.1.20 TCP 60 62537 → 1989 [ACK] Seq=1345 Ack=2017 Win=2051 Len=0
   80 2.609827872  192.168.1.2 → 192.168.1.20 UDP 78 38990 → 37388 Len=36
   81 2.611320628  192.168.1.3 → 192.168.1.20 ALLJOYN-ARDP 78 flags: ACK SEQ: 4239697881 ACK:  959768988
   82 2.611362815  192.168.1.3 → 192.168.1.20 UDP 78 59146 → 37388 Len=36
   83 2.611371579  192.168.1.3 → 192.168.1.20 UDP 78 48830 → 37388 Len=36
   84 2.612489110  192.168.1.4 → 192.168.1.20 UDP 78 48618 → 37388 Len=36
   85 2.612531134  192.168.1.4 → 192.168.1.20 ALLJOYN-ARDP 78 flags: ACK SEQ:   66284480 ACK: 3091424232
   86 2.616263223  192.168.1.2 → 192.168.1.20 ALLJOYN-ARDP 78 flags: ACK SEQ: 3553977248 ACK:   86639102
   87 2.716562559  192.168.1.3 → 192.168.1.20 UDP 78 48830 → 37388 Len=36
   88 2.719888544  192.168.1.3 → 192.168.1.20 UDP 78 59146 → 37388 Len=36
   89 2.721380864  192.168.1.2 → 192.168.1.20 UDP 78 38990 → 37388 Len=36
   90 2.749848416  192.168.1.2 → 192.168.1.20 ALLJOYN-ARDP 78 flags: ACK SEQ: 3553977248 ACK:   86639102
   91 2.842089496  192.168.1.4 → 192.168.1.20 ALLJOYN-ARDP 78 flags: ACK SEQ:   66284480 ACK: 3091424232
   92 2.857446865  192.168.1.3 → 192.168.1.20 ALLJOYN-ARDP 78 flags: ACK SEQ: 4239697881 ACK:  959768988
   93 2.965401029 24.20.126.47 → 192.168.1.20 TCP 118 62537 → 1989 [PSH, ACK] Seq=1345 Ack=2017 Win=2051 Len=64
   94 2.966404273 192.168.1.20 → 24.20.126.47 TCP 150 1989 → 62537 [PSH, ACK] Seq=2017 Ack=1409 Win=314 Len=96
   95 3.007002353 24.20.126.47 → 192.168.1.20 TCP 60 62537 → 1989 [ACK] Seq=1409 Ack=2113 Win=2050 Len=0
   96 3.013585240 24.20.126.47 → 192.168.1.20 TCP 118 62537 → 1989 [PSH, ACK] Seq=1409 Ack=2113 Win=2050 Len=64
   97 3.014317336 192.168.1.20 → 24.20.126.47 TCP 150 1989 → 62537 [PSH, ACK] Seq=2113 Ack=1473 Win=314 Len=96
   98 3.018915655 24.20.126.47 → 192.168.1.20 TCP 118 62537 → 1989 [PSH, ACK] Seq=1473 Ack=2209 Win=2050 Len=64
   99 3.019703584 192.168.1.20 → 24.20.126.47 TCP 150 1989 → 62537 [PSH, ACK] Seq=2209 Ack=1537 Win=314 Len=96
  100 3.059316821 24.20.126.47 → 192.168.1.20 TCP 60 62537 → 1989 [ACK] Seq=1537 Ack=2305 Win=2050 Len=0
  101 3.063114269 24.20.126.47 → 192.168.1.20 TCP 118 62537 → 1989 [PSH, ACK] Seq=1537 Ack=2305 Win=2050 Len=64
  102 3.064014159 192.168.1.20 → 24.20.126.47 TCP 150 1989 → 62537 [PSH, ACK] Seq=2305 Ack=1601 Win=314 Len=96
  103 3.085123365 24.20.126.47 → 192.168.1.20 TCP 118 62537 → 1989 [PSH, ACK] Seq=1601 Ack=2401 Win=2049 Len=64
  104 3.086125453 192.168.1.20 → 24.20.126.47 TCP 150 1989 → 62537 [PSH, ACK] Seq=2401 Ack=1665 Win=314 Len=96
  105 3.109947515 24.20.126.47 → 192.168.1.20 TCP 118 62537 → 1989 [PSH, ACK] Seq=1665 Ack=2497 Win=2049 Len=64
  106 3.110952769 192.168.1.20 → 24.20.126.47 TCP 150 1989 → 62537 [PSH, ACK] Seq=2497 Ack=1729 Win=314 Len=96
  107 3.152179958 24.20.126.47 → 192.168.1.20 TCP 60 62537 → 1989 [ACK] Seq=1729 Ack=2593 Win=2049 Len=0
  108 3.225161831 24.20.126.47 → 192.168.1.20 TCP 118 62537 → 1989 [PSH, ACK] Seq=1729 Ack=2593 Win=2049 Len=64
  109 3.226104944 192.168.1.20 → 24.20.126.47 TCP 150 1989 → 62537 [PSH, ACK] Seq=2593 Ack=1793 Win=314 Len=96
  110 3.226343543 24.20.126.47 → 192.168.1.20 TCP 118 62537 → 1989 [PSH, ACK] Seq=1793 Ack=2593 Win=2049 Len=64
  111 3.227094010 192.168.1.20 → 24.20.126.47 TCP 150 1989 → 62537 [PSH, ACK] Seq=2689 Ack=1857 Win=314 Len=96
  112 3.227423109 24.20.126.47 → 192.168.1.20 TCP 60 62537 → 1989 [ACK] Seq=1857 Ack=2785 Win=2048 Len=0
  113 3.262152967 24.20.126.47 → 192.168.1.20 TCP 118 62537 → 1989 [PSH, ACK] Seq=1857 Ack=2785 Win=2048 Len=64
  114 3.263215680 192.168.1.20 → 24.20.126.47 TCP 150 1989 → 62537 [PSH, ACK] Seq=2785 Ack=1921 Win=314 Len=96
  115 3.282177269 24.20.126.47 → 192.168.1.20 TCP 118 62537 → 1989 [PSH, ACK] Seq=1921 Ack=2881 Win=2047 Len=64
  116 3.283225570 192.168.1.20 → 24.20.126.47 TCP 150 1989 → 62537 [PSH, ACK] Seq=2881 Ack=1985 Win=314 Len=96
  117 3.305470416 24.20.126.47 → 192.168.1.20 TCP 118 62537 → 1989 [PSH, ACK] Seq=1985 Ack=2977 Win=2047 Len=64
  118 3.306470519 192.168.1.20 → 24.20.126.47 TCP 150 1989 → 62537 [PSH, ACK] Seq=2977 Ack=2049 Win=314 Len=96
  119 3.346677782 24.20.126.47 → 192.168.1.20 TCP 60 62537 → 1989 [ACK] Seq=2049 Ack=3073 Win=2053 Len=0
  120 3.838621196 24.20.126.47 → 192.168.1.20 TCP 118 62537 → 1989 [PSH, ACK] Seq=2049 Ack=3073 Win=2053 Len=64
  121 3.839651709 192.168.1.20 → 24.20.126.47 TCP 150 1989 → 62537 [PSH, ACK] Seq=3073 Ack=2113 Win=314 Len=96
  122 3.869228330 192.168.1.20 → 192.168.1.3  ALLJOYN 230 Message 0000000619: 'Signal emission' Chat (s)
  123 3.869647779 192.168.1.20 → 192.168.1.3  UDP 230 37388 → 59146 Len=188
  124 3.870060023 192.168.1.20 → 192.168.1.3  UDP 230 37388 → 48830 Len=188
  125 3.870422177 192.168.1.20 → 192.168.1.2  UDP 230 37388 → 38990 Len=188
  126 3.870847501 192.168.1.20 → 192.168.1.2  ALLJOYN 230 Message 0000000619: 'Signal emission' Chat (s)
  127 3.871185851 192.168.1.20 → 192.168.1.4  UDP 230 37388 → 48618 Len=188
  128 3.871592832 192.168.1.20 → 192.168.1.4  ALLJOYN 230 Message 0000000619: 'Signal emission' Chat (s)
  129 3.879822297 24.20.126.47 → 192.168.1.20 TCP 60 62537 → 1989 [ACK] Seq=2113 Ack=3169 Win=2052 Len=0
  130 3.979275228  192.168.1.2 → 192.168.1.20 UDP 78 38990 → 37388 Len=36
  131 3.979338498  192.168.1.2 → 192.168.1.20 ALLJOYN-ARDP 78 flags: ACK SEQ: 3553977248 ACK:   86639103
  132 3.979393244  192.168.1.3 → 192.168.1.20 UDP 78 48830 → 37388 Len=36
  133 3.979404980  192.168.1.3 → 192.168.1.20 UDP 78 59146 → 37388 Len=36
  134 3.979454330  192.168.1.3 → 192.168.1.20 ALLJOYN-ARDP 78 flags: ACK SEQ: 4239697881 ACK:  959768989
  135 3.980536286  192.168.1.4 → 192.168.1.20 UDP 78 48618 → 37388 Len=36
  136 3.980575207  192.168.1.4 → 192.168.1.20 ALLJOYN-ARDP 78 flags: ACK SEQ:   66284480 ACK: 3091424233
  137 4.099067070  192.168.1.4 → 192.168.1.20 UDP 78 48618 → 37388 Len=36
  138 4.134614170  192.168.1.3 → 192.168.1.20 UDP 78 48830 → 37388 Len=36
  139 4.134671968  192.168.1.3 → 192.168.1.20 UDP 78 59146 → 37388 Len=36
  140 4.137692552  192.168.1.2 → 192.168.1.20 UDP 78 38990 → 37388 Len=36
  141 4.178034290  192.168.1.3 → 192.168.1.20 ALLJOYN-ARDP 78 flags: ACK SEQ: 4239697881 ACK:  959768989
  142 4.234457861  192.168.1.2 → 192.168.1.20 ALLJOYN-ARDP 78 flags: ACK SEQ: 3553977248 ACK:   86639103
  143 4.265145229 24.20.126.47 → 192.168.1.20 TCP 118 62537 → 1989 [PSH, ACK] Seq=2113 Ack=3169 Win=2052 Len=64
  144 4.266133215 192.168.1.20 → 24.20.126.47 TCP 150 1989 → 62537 [PSH, ACK] Seq=3169 Ack=2177 Win=314 Len=96
  145 4.275737276  192.168.1.4 → 192.168.1.20 ALLJOYN-ARDP 78 flags: ACK SEQ:   66284480 ACK: 3091424233
  146 4.288705780 24.20.126.47 → 192.168.1.20 TCP 118 62537 → 1989 [PSH, ACK] Seq=2177 Ack=3265 Win=2052 Len=64
  147 4.289735385 192.168.1.20 → 24.20.126.47 TCP 150 1989 → 62537 [PSH, ACK] Seq=3265 Ack=2241 Win=314 Len=96
  148 4.310210407 24.20.126.47 → 192.168.1.20 TCP 118 62537 → 1989 [PSH, ACK] Seq=2241 Ack=3361 Win=2052 Len=64
  149 4.311245429 192.168.1.20 → 24.20.126.47 TCP 150 1989 → 62537 [PSH, ACK] Seq=3361 Ack=2305 Win=314 Len=96
  150 4.351552923 24.20.126.47 → 192.168.1.20 TCP 60 62537 → 1989 [ACK] Seq=2305 Ack=3457 Win=2051 Len=0
  151 4.357469626 24.20.126.47 → 192.168.1.20 TCP 118 62537 → 1989 [PSH, ACK] Seq=2305 Ack=3457 Win=2051 Len=64
  152 4.358471219 192.168.1.20 → 24.20.126.47 TCP 150 1989 → 62537 [PSH, ACK] Seq=3457 Ack=2369 Win=314 Len=96
  153 4.366257381 24.20.126.47 → 192.168.1.20 TCP 118 62537 → 1989 [PSH, ACK] Seq=2369 Ack=3553 Win=2051 Len=64
  154 4.367288501 192.168.1.20 → 24.20.126.47 TCP 150 1989 → 62537 [PSH, ACK] Seq=3553 Ack=2433 Win=314 Len=96
  155 4.384108787 24.20.126.47 → 192.168.1.20 TCP 118 62537 → 1989 [PSH, ACK] Seq=2433 Ack=3649 Win=2050 Len=64
  156 4.385009355 192.168.1.20 → 24.20.126.47 TCP 150 1989 → 62537 [PSH, ACK] Seq=3649 Ack=2497 Win=314 Len=96
  157 4.426001314 24.20.126.47 → 192.168.1.20 TCP 60 62537 → 1989 [ACK] Seq=2497 Ack=3745 Win=2050 Len=0
  158 4.500396270 24.20.126.47 → 192.168.1.20 TCP 118 62537 → 1989 [PSH, ACK] Seq=2497 Ack=3745 Win=2050 Len=64
  159 4.500518471 24.20.126.47 → 192.168.1.20 TCP 118 62537 → 1989 [PSH, ACK] Seq=2561 Ack=3745 Win=2050 Len=64
  160 4.500613491 192.168.1.20 → 24.20.126.47 TCP 54 1989 → 62537 [ACK] Seq=3745 Ack=2625 Win=314 Len=0
  161 4.501498271 192.168.1.20 → 24.20.126.47 TCP 150 1989 → 62537 [PSH, ACK] Seq=3745 Ack=2625 Win=314 Len=96
  162 4.542306942 24.20.126.47 → 192.168.1.20 TCP 60 62537 → 1989 [ACK] Seq=2625 Ack=3841 Win=2050 Len=0
  163 4.581035117 24.20.126.47 → 192.168.1.20 TCP 118 62537 → 1989 [PSH, ACK] Seq=2625 Ack=3841 Win=2050 Len=64
  164 4.582096617 192.168.1.20 → 24.20.126.47 TCP 150 1989 → 62537 [PSH, ACK] Seq=3841 Ack=2689 Win=314 Len=96
  165 4.596353414 24.20.126.47 → 192.168.1.20 TCP 118 62537 → 1989 [PSH, ACK] Seq=2689 Ack=3937 Win=2049 Len=64
  166 4.597379757 192.168.1.20 → 24.20.126.47 TCP 150 1989 → 62537 [PSH, ACK] Seq=3937 Ack=2753 Win=314 Len=96
  167 4.637975377 24.20.126.47 → 192.168.1.20 TCP 60 62537 → 1989 [ACK] Seq=2753 Ack=4033 Win=2049 Len=0
  168 5.096195545 24.20.126.47 → 192.168.1.20 TCP 118 62537 → 1989 [PSH, ACK] Seq=2753 Ack=4033 Win=2049 Len=64
  169 5.097169841 192.168.1.20 → 24.20.126.47 TCP 150 1989 → 62537 [PSH, ACK] Seq=4033 Ack=2817 Win=314 Len=96
  170 5.126372827 192.168.1.20 → 192.168.1.3  ALLJOYN 229 Message 0000000620: 'Signal emission' Chat (s)
  171 5.126789177 192.168.1.20 → 192.168.1.3  UDP 229 37388 → 59146 Len=187
  172 5.127176948 192.168.1.20 → 192.168.1.3  UDP 229 37388 → 48830 Len=187
  173 5.127514279 192.168.1.20 → 192.168.1.2  UDP 229 37388 → 38990 Len=187
  174 5.127892497 192.168.1.20 → 192.168.1.2  ALLJOYN 229 Message 0000000620: 'Signal emission' Chat (s)
  175 5.128279851 192.168.1.20 → 192.168.1.4  UDP 229 37388 → 48618 Len=187
  176 5.128644963 192.168.1.20 → 192.168.1.4  ALLJOYN 229 Message 0000000620: 'Signal emission' Chat (s)
  177 5.138334333 24.20.126.47 → 192.168.1.20 TCP 60 62537 → 1989 [ACK] Seq=2817 Ack=4129 Win=2049 Len=0
  178 5.235562582  192.168.1.3 → 192.168.1.20 UDP 78 48830 → 37388 Len=36
  179 5.235625331  192.168.1.3 → 192.168.1.20 UDP 78 59146 → 37388 Len=36
  180 5.235634250  192.168.1.3 → 192.168.1.20 ALLJOYN-ARDP 78 flags: ACK SEQ: 4239697881 ACK:  959768990
  181 5.236161228  192.168.1.2 → 192.168.1.20 ALLJOYN-ARDP 78 flags: ACK SEQ: 3553977248 ACK:   86639104
  182 5.236181107  192.168.1.2 → 192.168.1.20 UDP 78 38990 → 37388 Len=36
  183 5.239230881  192.168.1.4 → 192.168.1.20 UDP 78 48618 → 37388 Len=36
  184 5.239461783  192.168.1.4 → 192.168.1.20 ALLJOYN-ARDP 78 flags: ACK SEQ:   66284480 ACK: 3091424234
  185 5.345856333  192.168.1.4 → 192.168.1.20 UDP 78 48618 → 37388 Len=36
  186 5.538656190  192.168.1.2 → 192.168.1.20 ALLJOYN-ARDP 78 flags: ACK SEQ: 3553977248 ACK:   86639104
  187 5.571040691  192.168.1.4 → 192.168.1.20 ALLJOYN-ARDP 78 flags: ACK SEQ:   66284480 ACK: 3091424234
  188 5.573257132  192.168.1.3 → 192.168.1.20 ALLJOYN-ARDP 78 flags: ACK SEQ: 4239697881 ACK:  959768990
  189 5.587101487 24.20.126.47 → 192.168.1.20 TCP 118 62537 → 1989 [PSH, ACK] Seq=2817 Ack=4129 Win=2049 Len=64
  190 5.587982450 192.168.1.20 → 24.20.126.47 TCP 150 1989 → 62537 [PSH, ACK] Seq=4129 Ack=2881 Win=314 Len=96
  191 5.627869118 24.20.126.47 → 192.168.1.20 TCP 118 62537 → 1989 [PSH, ACK] Seq=2881 Ack=4225 Win=2048 Len=64
  192 5.628787763 192.168.1.20 → 24.20.126.47 TCP 150 1989 → 62537 [PSH, ACK] Seq=4225 Ack=2945 Win=314 Len=96
  193 5.647308498 24.20.126.47 → 192.168.1.20 TCP 118 62537 → 1989 [PSH, ACK] Seq=2945 Ack=4321 Win=2048 Len=64
  194 5.648295188 192.168.1.20 → 24.20.126.47 TCP 150 1989 → 62537 [PSH, ACK] Seq=4321 Ack=3009 Win=314 Len=96
  195 5.676193415 24.20.126.47 → 192.168.1.20 TCP 118 62537 → 1989 [PSH, ACK] Seq=3009 Ack=4417 Win=2047 Len=64
  196 5.677219036 192.168.1.20 → 24.20.126.47 TCP 150 1989 → 62537 [PSH, ACK] Seq=4417 Ack=3073 Win=314 Len=96
  197 5.690341572 24.20.126.47 → 192.168.1.20 TCP 118 62537 → 1989 [PSH, ACK] Seq=3073 Ack=4513 Win=2047 Len=64
  198 5.691393724 192.168.1.20 → 24.20.126.47 TCP 150 1989 → 62537 [PSH, ACK] Seq=4513 Ack=3137 Win=314 Len=96
  199 5.716083345 24.20.126.47 → 192.168.1.20 TCP 118 62537 → 1989 [PSH, ACK] Seq=3137 Ack=4609 Win=2053 Len=64
  200 5.717071919 192.168.1.20 → 24.20.126.47 TCP 150 1989 → 62537 [PSH, ACK] Seq=4609 Ack=3201 Win=314 Len=96
  201 5.754960317 24.20.126.47 → 192.168.1.20 TCP 118 62537 → 1989 [PSH, ACK] Seq=3201 Ack=4705 Win=2052 Len=64
  202 5.755952840 192.168.1.20 → 24.20.126.47 TCP 150 1989 → 62537 [PSH, ACK] Seq=4705 Ack=3265 Win=314 Len=96
  203 5.797047791 24.20.126.47 → 192.168.1.20 TCP 60 62537 → 1989 [ACK] Seq=3265 Ack=4801 Win=2052 Len=0
  204 5.856421851 24.20.126.47 → 192.168.1.20 TCP 118 62537 → 1989 [PSH, ACK] Seq=3265 Ack=4801 Win=2052 Len=64
  205 5.857418539 192.168.1.20 → 24.20.126.47 TCP 150 1989 → 62537 [PSH, ACK] Seq=4801 Ack=3329 Win=314 Len=96
  206 5.861736551 24.20.126.47 → 192.168.1.20 TCP 118 62537 → 1989 [PSH, ACK] Seq=3329 Ack=4897 Win=2052 Len=64
  207 5.862777481 192.168.1.20 → 24.20.126.47 TCP 150 1989 → 62537 [PSH, ACK] Seq=4897 Ack=3393 Win=314 Len=96
  208 5.873367438 24.20.126.47 → 192.168.1.20 TCP 118 62537 → 1989 [PSH, ACK] Seq=3393 Ack=4993 Win=2051 Len=64
  209 5.874390284 192.168.1.20 → 24.20.126.47 TCP 150 1989 → 62537 [PSH, ACK] Seq=4993 Ack=3457 Win=314 Len=96
  210 5.885043370 24.20.126.47 → 192.168.1.20 TCP 118 62537 → 1989 [PSH, ACK] Seq=3457 Ack=5089 Win=2051 Len=64
  211 5.886051498 192.168.1.20 → 24.20.126.47 TCP 150 1989 → 62537 [PSH, ACK] Seq=5089 Ack=3521 Win=314 Len=96
  212 5.921492062 24.20.126.47 → 192.168.1.20 TCP 118 62537 → 1989 [PSH, ACK] Seq=3521 Ack=5185 Win=2050 Len=64
  213 5.922506774 192.168.1.20 → 24.20.126.47 TCP 150 1989 → 62537 [PSH, ACK] Seq=5185 Ack=3585 Win=314 Len=96
  214 5.948636609 24.20.126.47 → 192.168.1.20 TCP 118 62537 → 1989 [PSH, ACK] Seq=3585 Ack=5281 Win=2050 Len=64
  215 5.949641279 192.168.1.20 → 24.20.126.47 TCP 150 1989 → 62537 [PSH, ACK] Seq=5281 Ack=3649 Win=314 Len=96
  216 5.990255640 24.20.126.47 → 192.168.1.20 TCP 60 62537 → 1989 [ACK] Seq=3649 Ack=5377 Win=2050 Len=0
  217 6.442293476 24.20.126.47 → 192.168.1.20 TCP 118 62537 → 1989 [PSH, ACK] Seq=3649 Ack=5377 Win=2050 Len=64
  218 6.443322649 192.168.1.20 → 24.20.126.47 TCP 150 1989 → 62537 [PSH, ACK] Seq=5377 Ack=3713 Win=314 Len=96
  219 6.473014757 192.168.1.20 → 192.168.1.3  ALLJOYN 232 Message 0000000621: 'Signal emission' Chat (s)
  220 6.473424628 192.168.1.20 → 192.168.1.3  UDP 232 37388 → 59146 Len=190
  221 6.473810707 192.168.1.20 → 192.168.1.3  UDP 232 37388 → 48830 Len=190
  222 6.474142827 192.168.1.20 → 192.168.1.2  UDP 232 37388 → 38990 Len=190
  223 6.474472200 192.168.1.20 → 192.168.1.2  ALLJOYN 232 Message 0000000621: 'Signal emission' Chat (s)
  224 6.474875810 192.168.1.20 → 192.168.1.4  UDP 232 37388 → 48618 Len=190
  225 6.475269398 192.168.1.20 → 192.168.1.4  ALLJOYN 232 Message 0000000621: 'Signal emission' Chat (s)
  226 6.484212915 24.20.126.47 → 192.168.1.20 TCP 60 62537 → 1989 [ACK] Seq=3713 Ack=5473 Win=2049 Len=0
  227 6.580121161  192.168.1.2 → 192.168.1.20 UDP 78 38990 → 37388 Len=36
  228 6.580607103  192.168.1.2 → 192.168.1.20 ALLJOYN-ARDP 78 flags: ACK SEQ: 3553977248 ACK:   86639105
  229 6.581482972  192.168.1.3 → 192.168.1.20 UDP 78 48830 → 37388 Len=36
  230 6.581519929  192.168.1.3 → 192.168.1.20 ALLJOYN-ARDP 78 flags: ACK SEQ: 4239697881 ACK:  959768991
  231 6.583932307  192.168.1.4 → 192.168.1.20 UDP 78 48618 → 37388 Len=36
  232 6.589465525  192.168.1.3 → 192.168.1.20 UDP 78 59146 → 37388 Len=36
  233 6.592712556  192.168.1.4 → 192.168.1.20 ALLJOYN-ARDP 78 flags: ACK SEQ:   66284480 ACK: 3091424235
  234 6.690446507  192.168.1.3 → 192.168.1.20 UDP 78 48830 → 37388 Len=36
  235 6.714612545  192.168.1.3 → 192.168.1.20 UDP 78 59146 → 37388 Len=36
  236 6.733522173  192.168.1.2 → 192.168.1.20 ALLJOYN-ARDP 78 flags: ACK SEQ: 3553977248 ACK:   86639105
  237 6.769401521  192.168.1.4 → 192.168.1.20 ALLJOYN-ARDP 78 flags: ACK SEQ:   66284480 ACK: 3091424235
  238 6.895272536  192.168.1.3 → 192.168.1.20 ALLJOYN-ARDP 78 flags: ACK SEQ: 4239697881 ACK:  959768991
