    1 0.000000000 24.20.126.47 → 192.168.1.20 TCP 118 62537 → 1989 [PSH, ACK] Seq=1 Ack=1 Win=2053 Len=64
    2 0.001017955 192.168.1.20 → 24.20.126.47 TCP 150 1989 → 62537 [PSH, ACK] Seq=1 Ack=65 Win=337 Len=96
    3 0.029674834 24.20.126.47 → 192.168.1.20 TCP 118 62537 → 1989 [PSH, ACK] Seq=65 Ack=97 Win=2052 Len=64
    4 0.030705146 192.168.1.20 → 24.20.126.47 TCP 150 1989 → 62537 [PSH, ACK] Seq=97 Ack=129 Win=337 Len=96
    5 0.070839896 24.20.126.47 → 192.168.1.20 TCP 118 62537 → 1989 [PSH, ACK] Seq=129 Ack=193 Win=2052 Len=64
    6 0.071855263 192.168.1.20 → 24.20.126.47 TCP 150 1989 → 62537 [PSH, ACK] Seq=193 Ack=193 Win=337 Len=96
    7 0.102003925 24.20.126.47 → 192.168.1.20 TCP 118 62537 → 1989 [PSH, ACK] Seq=193 Ack=289 Win=2052 Len=64
    8 0.103023830 192.168.1.20 → 24.20.126.47 TCP 150 1989 → 62537 [PSH, ACK] Seq=289 Ack=257 Win=337 Len=96
    9 0.142161015 24.20.126.47 → 192.168.1.20 TCP 118 62537 → 1989 [PSH, ACK] Seq=257 Ack=385 Win=2051 Len=64
   10 0.143199183 192.168.1.20 → 24.20.126.47 TCP 150 1989 → 62537 [PSH, ACK] Seq=385 Ack=321 Win=337 Len=96
   11 0.163937403 24.20.126.47 → 192.168.1.20 TCP 118 62537 → 1989 [PSH, ACK] Seq=321 Ack=481 Win=2051 Len=64
   12 0.164975871 192.168.1.20 → 24.20.126.47 TCP 150 1989 → 62537 [PSH, ACK] Seq=481 Ack=385 Win=337 Len=96
   13 0.206369086 24.20.126.47 → 192.168.1.20 TCP 60 62537 → 1989 [ACK] Seq=385 Ack=577 Win=2050 Len=0
   14 0.270225636 24.20.126.47 → 192.168.1.20 TCP 118 62537 → 1989 [PSH, ACK] Seq=385 Ack=577 Win=2050 Len=64
   15 0.270616757 24.20.126.47 → 192.168.1.20 TCP 118 62537 → 1989 [PSH, ACK] Seq=449 Ack=577 Win=2050 Len=64
   16 0.270734587 192.168.1.20 → 24.20.126.47 TCP 54 1989 → 62537 [ACK] Seq=577 Ack=513 Win=337 Len=0
   17 0.271281934 192.168.1.20 → 24.20.126.47 TCP 150 1989 → 62537 [PSH, ACK] Seq=577 Ack=513 Win=337 Len=96
   18 0.271566909 192.168.1.20 → 24.20.126.47 TCP 150 1989 → 62537 [PSH, ACK] Seq=673 Ack=513 Win=337 Len=96
   19 0.271834692 24.20.126.47 → 192.168.1.20 TCP 60 62537 → 1989 [ACK] Seq=513 Ack=769 Win=2050 Len=0
   20 0.292952207 24.20.126.47 → 192.168.1.20 TCP 118 62537 → 1989 [PSH, ACK] Seq=513 Ack=769 Win=2050 Len=64
   21 0.294026089 192.168.1.20 → 24.20.126.47 TCP 150 1989 → 62537 [PSH, ACK] Seq=769 Ack=577 Win=337 Len=96
   22 0.326348376 24.20.126.47 → 192.168.1.20 TCP 118 62537 → 1989 [PSH, ACK] Seq=577 Ack=865 Win=2049 Len=64
   23 0.327385792 192.168.1.20 → 24.20.126.47 TCP 150 1989 → 62537 [PSH, ACK] Seq=865 Ack=641 Win=337 Len=96
   24 0.367934876 24.20.126.47 → 192.168.1.20 TCP 60 62537 → 1989 [ACK] Seq=641 Ack=961 Win=2049 Len=0
   25 0.373699709 24.20.126.47 → 192.168.1.20 TCP 118 62537 → 1989 [PSH, ACK] Seq=641 Ack=961 Win=2049 Len=64
   26 0.374047299 24.20.126.47 → 192.168.1.20 TCP 118 62537 → 1989 [PSH, ACK] Seq=705 Ack=961 Win=2049 Len=64
   27 0.374169269 192.168.1.20 → 24.20.126.47 TCP 54 1989 → 62537 [ACK] Seq=961 Ack=769 Win=337 Len=0
   28 0.374744927 192.168.1.20 → 24.20.126.47 TCP 150 1989 → 62537 [PSH, ACK] Seq=961 Ack=769 Win=337 Len=96
   29 0.375027518 192.168.1.20 → 24.20.126.47 TCP 150 1989 → 62537 [PSH, ACK] Seq=1057 Ack=769 Win=337 Len=96
   30 0.375309597 24.20.126.47 → 192.168.1.20 TCP 60 62537 → 1989 [ACK] Seq=769 Ack=1153 Win=2048 Len=0
   31 0.750324135 24.20.126.47 → 192.168.1.20 TCP 118 62537 → 1989 [PSH, ACK] Seq=769 Ack=1153 Win=2048 Len=64
   32 0.751345129 192.168.1.20 → 24.20.126.47 TCP 150 1989 → 62537 [PSH, ACK] Seq=1153 Ack=833 Win=337 Len=96
   33 0.789057933 192.168.1.20 → 192.168.1.3  ALLJOYN 231 Message 0000000822: 'Signal emission' Chat (s)
   34 0.789470141 192.168.1.20 → 192.168.1.3  UDP 231 37388 → 59146 Len=189
   35 0.789800737 192.168.1.20 → 192.168.1.3  UDP 231 37388 → 48830 Len=189
   36 0.790163577 192.168.1.20 → 192.168.1.5  UDP 231 37388 → 60277 Len=189
   37 0.790485412 192.168.1.20 → 192.168.1.2  UDP 231 37388 → 38990 Len=189
   38 0.790814023 192.168.1.20 → 192.168.1.2  ALLJOYN 231 Message 0000000822: 'Signal emission' Chat (s)
   39 0.790913459 24.20.126.47 → 192.168.1.20 TCP 60 62537 → 1989 [ACK] Seq=833 Ack=1249 Win=2048 Len=0
   40 0.791152100 192.168.1.20 → 192.168.1.4  UDP 231 37388 → 48618 Len=189
   41 0.791486982 192.168.1.20 → 192.168.1.4  ALLJOYN 231 Message 0000000822: 'Signal emission' Chat (s)
   42 0.791847463 192.168.1.20 → 192.168.1.5  ALLJOYN 231 Message 0000000822: 'Signal emission' Chat (s)
   43 0.910361371  192.168.1.3 → 192.168.1.20 ALLJOYN-ARDP 78 flags: ACK SEQ: 4239715854 ACK:  959778017
   44 0.910527989  192.168.1.5 → 192.168.1.20 UDP 78 60277 → 37388 Len=36
   45 0.920197557  192.168.1.2 → 192.168.1.20 UDP 78 38990 → 37388 Len=36
   46 0.920832493  192.168.1.5 → 192.168.1.20 ALLJOYN-ARDP 78 flags: ACK SEQ:  994254277 ACK: 1796320321
   47 0.922120097  192.168.1.3 → 192.168.1.20 UDP 78 59146 → 37388 Len=36
   48 0.923140210  192.168.1.2 → 192.168.1.20 ALLJOYN-ARDP 78 flags: ACK SEQ: 3553995387 ACK:   86648325
   49 0.923565511  192.168.1.3 → 192.168.1.20 UDP 78 48830 → 37388 Len=36
   50 0.926841917  192.168.1.4 → 192.168.1.20 UDP 78 48618 → 37388 Len=36
   51 0.935331295  192.168.1.4 → 192.168.1.20 ALLJOYN-ARDP 78 flags: ACK SEQ:   66301960 ACK: 3091433164
   52 0.987978564  192.168.1.3 → 192.168.1.20 UDP 250 51558 → 58942 Len=208
   53 0.991396527 192.168.1.20 → 192.168.1.3  UDP 493 58942 → 51558 Len=451
   54 0.993874114 192.168.1.20 → 192.168.1.3  UDP 493 58942 → 51558 Len=451
   55 1.047892491  192.168.1.5 → 192.168.1.20 UDP 78 60277 → 37388 Len=36
   56 1.048058298  192.168.1.4 → 192.168.1.20 UDP 78 48618 → 37388 Len=36
   57 1.055718525  192.168.1.2 → 192.168.1.20 ALLJOYN-ARDP 78 flags: ACK SEQ: 3553995387 ACK:   86648325
   58 1.102712619  192.168.1.3 → 192.168.1.20 UDP 78 48830 → 37388 Len=36
   59 1.109764528  192.168.1.3 → 192.168.1.20 UDP 78 59146 → 37388 Len=36
   60 1.193753251  192.168.1.3 → 192.168.1.20 ALLJOYN-ARDP 78 flags: ACK SEQ: 4239715854 ACK:  959778017
   61 1.216190200  192.168.1.4 → 192.168.1.20 ALLJOYN-ARDP 78 flags: ACK SEQ:   66301960 ACK: 3091433164
   62 1.246959724  192.168.1.5 → 192.168.1.20 ALLJOYN-ARDP 78 flags: ACK SEQ:  994254277 ACK: 1796320321
   63 1.323013974 24.20.126.47 → 192.168.1.20 TCP 118 62537 → 1989 [PSH, ACK] Seq=833 Ack=1249 Win=2048 Len=64
   64 1.323947291 192.168.1.20 → 24.20.126.47 TCP 150 1989 → 62537 [PSH, ACK] Seq=1249 Ack=897 Win=337 Len=96
   65 1.339150169 24.20.126.47 → 192.168.1.20 TCP 118 62537 → 1989 [PSH, ACK] Seq=897 Ack=1345 Win=2047 Len=64
   66 1.340032782 192.168.1.20 → 24.20.126.47 TCP 150 1989 → 62537 [PSH, ACK] Seq=1345 Ack=961 Win=337 Len=96
   67 1.370328942 24.20.126.47 → 192.168.1.20 TCP 118 62537 → 1989 [PSH, ACK] Seq=961 Ack=1441 Win=2047 Len=64
   68 1.371196334 192.168.1.20 → 24.20.126.47 TCP 150 1989 → 62537 [PSH, ACK] Seq=1441 Ack=1025 Win=337 Len=96
   69 1.388750480 24.20.126.47 → 192.168.1.20 TCP 118 62537 → 1989 [PSH, ACK] Seq=1025 Ack=1537 Win=2053 Len=64
   70 1.389622377 192.168.1.20 → 24.20.126.47 TCP 150 1989 → 62537 [PSH, ACK] Seq=1537 Ack=1089 Win=337 Len=96
   71 1.430804304 24.20.126.47 → 192.168.1.20 TCP 60 62537 → 1989 [ACK] Seq=1089 Ack=1633 Win=2052 Len=0
   72 1.431235654 24.20.126.47 → 192.168.1.20 TCP 118 62537 → 1989 [PSH, ACK] Seq=1089 Ack=1633 Win=2052 Len=64
   73 1.432306238 192.168.1.20 → 24.20.126.47 TCP 150 1989 → 62537 [PSH, ACK] Seq=1633 Ack=1153 Win=337 Len=96
   74 1.433556455 24.20.126.47 → 192.168.1.20 TCP 118 62537 → 1989 [PSH, ACK] Seq=1153 Ack=1729 Win=2052 Len=64
   75 1.434397722 192.168.1.20 → 24.20.126.47 TCP 150 1989 → 62537 [PSH, ACK] Seq=1729 Ack=1217 Win=337 Len=96
   76 1.474655299 24.20.126.47 → 192.168.1.20 TCP 60 62537 → 1989 [ACK] Seq=1217 Ack=1825 Win=2052 Len=0
   77 1.582936605 24.20.126.47 → 192.168.1.20 TCP 118 62537 → 1989 [PSH, ACK] Seq=1217 Ack=1825 Win=2052 Len=64
   78 1.583230039 24.20.126.47 → 192.168.1.20 TCP 118 62537 → 1989 [PSH, ACK] Seq=1281 Ack=1825 Win=2052 Len=64
   79 1.583312533 192.168.1.20 → 24.20.126.47 TCP 54 1989 → 62537 [ACK] Seq=1825 Ack=1345 Win=337 Len=0
   80 1.584021755 192.168.1.20 → 24.20.126.47 TCP 150 1989 → 62537 [PSH, ACK] Seq=1825 Ack=1345 Win=337 Len=96
   81 1.584524878 24.20.126.47 → 192.168.1.20 TCP 118 62537 → 1989 [PSH, ACK] Seq=1345 Ack=1921 Win=2051 Len=64
   82 1.585191794 192.168.1.20 → 24.20.126.47 TCP 150 1989 → 62537 [PSH, ACK] Seq=1921 Ack=1409 Win=337 Len=96
   83 1.613708013 24.20.126.47 → 192.168.1.20 TCP 118 62537 → 1989 [PSH, ACK] Seq=1409 Ack=2017 Win=2051 Len=64
   84 1.614710417 192.168.1.20 → 24.20.126.47 TCP 150 1989 → 62537 [PSH, ACK] Seq=2017 Ack=1473 Win=337 Len=96
   85 1.656254687 24.20.126.47 → 192.168.1.20 TCP 60 62537 → 1989 [ACK] Seq=1473 Ack=2113 Win=2050 Len=0
   86 1.658328819 24.20.126.47 → 192.168.1.20 TCP 118 62537 → 1989 [PSH, ACK] Seq=1473 Ack=2113 Win=2050 Len=64
   87 1.658786487 24.20.126.47 → 192.168.1.20 TCP 118 62537 → 1989 [PSH, ACK] Seq=1537 Ack=2113 Win=2050 Len=64
   88 1.658910515 192.168.1.20 → 24.20.126.47 TCP 54 1989 → 62537 [ACK] Seq=2113 Ack=1601 Win=337 Len=0
   89 1.659319264 192.168.1.20 → 24.20.126.47 TCP 150 1989 → 62537 [PSH, ACK] Seq=2113 Ack=1601 Win=337 Len=96
   90 1.659606620 192.168.1.20 → 24.20.126.47 TCP 150 1989 → 62537 [PSH, ACK] Seq=2209 Ack=1601 Win=337 Len=96
   91 1.659884236 24.20.126.47 → 192.168.1.20 TCP 60 62537 → 1989 [ACK] Seq=1601 Ack=2305 Win=2050 Len=0
   92 2.029100359 24.20.126.47 → 192.168.1.20 TCP 118 62537 → 1989 [PSH, ACK] Seq=1601 Ack=2305 Win=2050 Len=64
   93 2.030128289 192.168.1.20 → 24.20.126.47 TCP 150 1989 → 62537 [PSH, ACK] Seq=2305 Ack=1665 Win=337 Len=96
   94 2.068056885 192.168.1.20 → 192.168.1.3  ALLJOYN 231 Message 0000000823: 'Signal emission' Chat (s)
   95 2.068561385 192.168.1.20 → 192.168.1.3  UDP 231 37388 → 59146 Len=189
   96 2.069088508 192.168.1.20 → 192.168.1.3  UDP 231 37388 → 48830 Len=189
   97 2.069656005 192.168.1.20 → 192.168.1.5  UDP 231 37388 → 60277 Len=189
   98 2.069988639 192.168.1.20 → 192.168.1.2  UDP 231 37388 → 38990 Len=189
   99 2.070323986 192.168.1.20 → 192.168.1.2  ALLJOYN 231 Message 0000000823: 'Signal emission' Chat (s)
  100 2.070634438 192.168.1.20 → 192.168.1.4  UDP 231 37388 → 48618 Len=189
  101 2.070866066 24.20.126.47 → 192.168.1.20 TCP 60 62537 → 1989 [ACK] Seq=1665 Ack=2401 Win=2049 Len=0
  102 2.071062627 192.168.1.20 → 192.168.1.4  ALLJOYN 231 Message 0000000823: 'Signal emission' Chat (s)
  103 2.071383260 192.168.1.20 → 192.168.1.5  ALLJOYN 231 Message 0000000823: 'Signal emission' Chat (s)
  104 2.179480881  192.168.1.3 → 192.168.1.20 UDP 78 59146 → 37388 Len=36
  105 2.179518907  192.168.1.3 → 192.168.1.20 ALLJOYN-ARDP 78 flags: ACK SEQ: 4239715854 ACK:  959778018
  106 2.179525208  192.168.1.3 → 192.168.1.20 UDP 78 48830 → 37388 Len=36
  107 2.187353157  192.168.1.2 → 192.168.1.20 ALLJOYN-ARDP 78 flags: ACK SEQ: 3553995387 ACK:   86648326
  108 2.187387952  192.168.1.2 → 192.168.1.20 UDP 78 38990 → 37388 Len=36
  109 2.187560546  192.168.1.5 → 192.168.1.20 UDP 78 60277 → 37388 Len=36
  110 2.187569403  192.168.1.5 → 192.168.1.20 ALLJOYN-ARDP 78 flags: ACK SEQ:  994254277 ACK: 1796320322
  111 2.192359168  192.168.1.4 → 192.168.1.20 UDP 78 48618 → 37388 Len=36
  112 2.192779582  192.168.1.4 → 192.168.1.20 ALLJOYN-ARDP 78 flags: ACK SEQ:   66301960 ACK: 3091433165
  113 2.239007130  192.168.1.7 → 239.255.255.250 SSDP 164 M-SEARCH * HTTP/1.1 
  114 2.302402142  192.168.1.5 → 192.168.1.20 UDP 78 60277 → 37388 Len=36
  115 2.324083445  192.168.1.2 → 192.168.1.20 UDP 78 38990 → 37388 Len=36
  116 2.327500097  192.168.1.3 → 192.168.1.20 UDP 78 48830 → 37388 Len=36
  117 2.341721686  192.168.1.7 → 239.255.255.250 SSDP 167 M-SEARCH * HTTP/1.1 
  118 2.374582309  192.168.1.3 → 192.168.1.20 UDP 78 59146 → 37388 Len=36
  119 2.394427876  192.168.1.2 → 192.168.1.20 ALLJOYN-ARDP 78 flags: ACK SEQ: 3553995387 ACK:   86648326
  120 2.437024463  192.168.1.5 → 192.168.1.20 ALLJOYN-ARDP 78 flags: ACK SEQ:  994254277 ACK: 1796320322
  121 2.489732865  192.168.1.4 → 192.168.1.20 ALLJOYN-ARDP 78 flags: ACK SEQ:   66301960 ACK: 3091433165
  122 2.506561919  192.168.1.3 → 192.168.1.20 ALLJOYN-ARDP 78 flags: ACK SEQ: 4239715854 ACK:  959778018
  123 2.600224692 24.20.126.47 → 192.168.1.20 TCP 118 62537 → 1989 [PSH, ACK] Seq=1665 Ack=2401 Win=2049 Len=64
  124 2.601249965 192.168.1.20 → 24.20.126.47 TCP 150 1989 → 62537 [PSH, ACK] Seq=2401 Ack=1729 Win=337 Len=96
  125 2.628870008 24.20.126.47 → 192.168.1.20 TCP 118 62537 → 1989 [PSH, ACK] Seq=1729 Ack=2497 Win=2049 Len=64
  126 2.629944857 192.168.1.20 → 24.20.126.47 TCP 150 1989 → 62537 [PSH, ACK] Seq=2497 Ack=1793 Win=337 Len=96
  127 2.659715219 24.20.126.47 → 192.168.1.20 TCP 118 62537 → 1989 [PSH, ACK] Seq=1793 Ack=2593 Win=2049 Len=64
  128 2.660716988 192.168.1.20 → 24.20.126.47 TCP 150 1989 → 62537 [PSH, ACK] Seq=2593 Ack=1857 Win=337 Len=96
  129 2.673289564 24.20.126.47 → 192.168.1.20 TCP 118 62537 → 1989 [PSH, ACK] Seq=1857 Ack=2689 Win=2048 Len=64
  130 2.674273565 192.168.1.20 → 24.20.126.47 TCP 150 1989 → 62537 [PSH, ACK] Seq=2689 Ack=1921 Win=337 Len=96
  131 2.715294830 24.20.126.47 → 192.168.1.20 TCP 60 62537 → 1989 [ACK] Seq=1921 Ack=2785 Win=2048 Len=0
  132 2.725339474 24.20.126.47 → 192.168.1.20 TCP 118 62537 → 1989 [PSH, ACK] Seq=1921 Ack=2785 Win=2048 Len=64
  133 2.726367434 192.168.1.20 → 24.20.126.47 TCP 150 1989 → 62537 [PSH, ACK] Seq=2785 Ack=1985 Win=337 Len=96
  134 2.732326252 24.20.126.47 → 192.168.1.20 TCP 118 62537 → 1989 [PSH, ACK] Seq=1985 Ack=2881 Win=2047 Len=64
  135 2.733379513 192.168.1.20 → 24.20.126.47 TCP 150 1989 → 62537 [PSH, ACK] Seq=2881 Ack=2049 Win=337 Len=96
  136 2.774291847 24.20.126.47 → 192.168.1.20 TCP 60 62537 → 1989 [ACK] Seq=2049 Ack=2977 Win=2047 Len=0
  137 2.871248447 24.20.126.47 → 192.168.1.20 TCP 118 62537 → 1989 [PSH, ACK] Seq=2049 Ack=2977 Win=2047 Len=64
  138 2.872277649 192.168.1.20 → 24.20.126.47 TCP 150 1989 → 62537 [PSH, ACK] Seq=2977 Ack=2113 Win=337 Len=96
  139 2.886997778 24.20.126.47 → 192.168.1.20 TCP 118 62537 → 1989 [PSH, ACK] Seq=2113 Ack=3073 Win=2053 Len=64
  140 2.888009562 192.168.1.20 → 24.20.126.47 TCP 150 1989 → 62537 [PSH, ACK] Seq=3073 Ack=2177 Win=337 Len=96
  141 2.893994958 24.20.126.47 → 192.168.1.20 TCP 118 62537 → 1989 [PSH, ACK] Seq=2177 Ack=3169 Win=2052 Len=64
  142 2.895012936 192.168.1.20 → 24.20.126.47 TCP 150 1989 → 62537 [PSH, ACK] Seq=3169 Ack=2241 Win=337 Len=96
  143 2.935410393 24.20.126.47 → 192.168.1.20 TCP 60 62537 → 1989 [ACK] Seq=2241 Ack=3265 Win=2052 Len=0
  144 2.938705235 24.20.126.47 → 192.168.1.20 TCP 118 62537 → 1989 [PSH, ACK] Seq=2241 Ack=3265 Win=2052 Len=64
  145 2.939747196 192.168.1.20 → 24.20.126.47 TCP 150 1989 → 62537 [PSH, ACK] Seq=3265 Ack=2305 Win=337 Len=96
  146 2.945276082 24.20.126.47 → 192.168.1.20 TCP 118 62537 → 1989 [PSH, ACK] Seq=2305 Ack=3361 Win=2052 Len=64
  147 2.946295087 192.168.1.20 → 24.20.126.47 TCP 150 1989 → 62537 [PSH, ACK] Seq=3361 Ack=2369 Win=337 Len=96
  148 2.950670495 24.20.126.47 → 192.168.1.20 TCP 118 62537 → 1989 [PSH, ACK] Seq=2369 Ack=3457 Win=2051 Len=64
  149 2.951676632 192.168.1.20 → 24.20.126.47 TCP 150 1989 → 62537 [PSH, ACK] Seq=3457 Ack=2433 Win=337 Len=96
  150 2.992355733 24.20.126.47 → 192.168.1.20 TCP 60 62537 → 1989 [ACK] Seq=2433 Ack=3553 Win=2051 Len=0
  151 3.254073726 192.168.1.11 → 192.168.1.255 UDP 72 58444 → 27036 Len=30
  152 3.368975469 24.20.126.47 → 192.168.1.20 TCP 118 62537 → 1989 [PSH, ACK] Seq=2433 Ack=3553 Win=2051 Len=64
  153 3.370002963 192.168.1.20 → 24.20.126.47 TCP 150 1989 → 62537 [PSH, ACK] Seq=3553 Ack=2497 Win=337 Len=96
  154 3.408248633 192.168.1.20 → 192.168.1.3  ALLJOYN 231 Message 0000000824: 'Signal emission' Chat (s)
  155 3.408689745 192.168.1.20 → 192.168.1.3  UDP 231 37388 → 59146 Len=189
  156 3.409097564 192.168.1.20 → 192.168.1.3  UDP 231 37388 → 48830 Len=189
  157 3.409482053 192.168.1.20 → 192.168.1.5  UDP 231 37388 → 60277 Len=189
  158 3.409841372 192.168.1.20 → 192.168.1.2  UDP 231 37388 → 38990 Len=189
  159 3.410174375 192.168.1.20 → 192.168.1.2  ALLJOYN 231 Message 0000000824: 'Signal emission' Chat (s)
  160 3.410293087 24.20.126.47 → 192.168.1.20 TCP 60 62537 → 1989 [ACK] Seq=2497 Ack=3649 Win=2050 Len=0
  161 3.410421022 192.168.1.20 → 192.168.1.4  UDP 231 37388 → 48618 Len=189
  162 3.410772779 192.168.1.20 → 192.168.1.4  ALLJOYN 231 Message 0000000824: 'Signal emission' Chat (s)
  163 3.411096178 192.168.1.20 → 192.168.1.5  ALLJOYN 231 Message 0000000824: 'Signal emission' Chat (s)
  164 3.514507529  192.168.1.3 → 192.168.1.20 ALLJOYN-ARDP 78 flags: ACK SEQ: 4239715854 ACK:  959778019
  165 3.514549051  192.168.1.3 → 192.168.1.20 UDP 78 48830 → 37388 Len=36
  166 3.514556816  192.168.1.3 → 192.168.1.20 UDP 78 59146 → 37388 Len=36
  167 3.514721122  192.168.1.5 → 192.168.1.20 UDP 78 60277 → 37388 Len=36
  168 3.516503884  192.168.1.4 → 192.168.1.20 UDP 78 48618 → 37388 Len=36
  169 3.516708162  192.168.1.2 → 192.168.1.20 UDP 78 38990 → 37388 Len=36
  170 3.524589614  192.168.1.2 → 192.168.1.20 ALLJOYN-ARDP 78 flags: ACK SEQ: 3553995387 ACK:   86648327
  171 3.525555139  192.168.1.4 → 192.168.1.20 ALLJOYN-ARDP 78 flags: ACK SEQ:   66301960 ACK: 3091433166
  172 3.525856671  192.168.1.5 → 192.168.1.20 ALLJOYN-ARDP 78 flags: ACK SEQ:  994254277 ACK: 1796320323
  173 3.634068110  192.168.1.5 → 192.168.1.20 UDP 78 60277 → 37388 Len=36
  174 3.676779949  192.168.1.4 → 192.168.1.20 UDP 78 48618 → 37388 Len=36
  175 3.717692474  192.168.1.2 → 192.168.1.20 UDP 250 59379 → 58942 Len=208
  176 3.719581088 192.168.1.20 → 192.168.1.2  UDP 493 58942 → 59379 Len=451
  177 3.721065969 192.168.1.20 → 192.168.1.2  UDP 493 58942 → 59379 Len=451
  178 3.745887316  192.168.1.2 → 192.168.1.20 ALLJOYN-ARDP 78 flags: ACK SEQ: 3553995387 ACK:   86648327
  179 3.771230371  192.168.1.5 → 192.168.1.20 ALLJOYN-ARDP 78 flags: ACK SEQ:  994254277 ACK: 1796320323
  180 3.778832116  192.168.1.3 → 192.168.1.20 ALLJOYN-ARDP 78 flags: ACK SEQ: 4239715854 ACK:  959778019
  181 3.821579748  192.168.1.4 → 192.168.1.20 ALLJOYN-ARDP 78 flags: ACK SEQ:   66301960 ACK: 3091433166
  182 3.908841488 24.20.126.47 → 192.168.1.20 TCP 118 62537 → 1989 [PSH, ACK] Seq=2497 Ack=3649 Win=2050 Len=64
  183 3.909559456 192.168.1.20 → 24.20.126.47 TCP 150 1989 → 62537 [PSH, ACK] Seq=3649 Ack=2561 Win=337 Len=96
  184 3.950918615 24.20.126.47 → 192.168.1.20 TCP 60 62537 → 1989 [ACK] Seq=2561 Ack=3745 Win=2050 Len=0
  185 3.953951981 24.20.126.47 → 192.168.1.20 TCP 118 62537 → 1989 [PSH, ACK] Seq=2561 Ack=3745 Win=2050 Len=64
  186 3.954864315 24.20.126.47 → 192.168.1.20 TCP 118 62537 → 1989 [PSH, ACK] Seq=2625 Ack=3745 Win=2050 Len=64
  187 3.954981840 192.168.1.20 → 24.20.126.47 TCP 54 1989 → 62537 [ACK] Seq=3745 Ack=2689 Win=337 Len=0
  188 3.955092104 192.168.1.20 → 24.20.126.47 TCP 150 1989 → 62537 [PSH, ACK] Seq=3745 Ack=2689 Win=337 Len=96
  189 3.955764177 192.168.1.20 → 24.20.126.47 TCP 150 1989 → 62537 [PSH, ACK] Seq=3841 Ack=2689 Win=337 Len=96
  190 3.956042112 24.20.126.47 → 192.168.1.20 TCP 60 62537 → 1989 [ACK] Seq=2689 Ack=3937 Win=2049 Len=0
  191 3.995828262 24.20.126.47 → 192.168.1.20 TCP 118 62537 → 1989 [PSH, ACK] Seq=2689 Ack=3937 Win=2049 Len=64
  192 3.996835295 192.168.1.20 → 24.20.126.47 TCP 150 1989 → 62537 [PSH, ACK] Seq=3937 Ack=2753 Win=337 Len=96
  193 4.033505679 24.20.126.47 → 192.168.1.20 TCP 118 62537 → 1989 [PSH, ACK] Seq=2753 Ack=4033 Win=2049 Len=64
  194 4.034574860 192.168.1.20 → 24.20.126.47 TCP 150 1989 → 62537 [PSH, ACK] Seq=4033 Ack=2817 Win=337 Len=96
  195 4.035108255 24.20.126.47 → 192.168.1.20 TCP 118 62537 → 1989 [PSH, ACK] Seq=2817 Ack=4129 Win=2049 Len=64
  196 4.035958512 192.168.1.20 → 24.20.126.47 TCP 150 1989 → 62537 [PSH, ACK] Seq=4129 Ack=2881 Win=337 Len=96
  197 4.076407969 24.20.126.47 → 192.168.1.20 TCP 60 62537 → 1989 [ACK] Seq=2881 Ack=4225 Win=2048 Len=0
  198 4.203736835 24.20.126.47 → 192.168.1.20 TCP 118 62537 → 1989 [PSH, ACK] Seq=2881 Ack=4225 Win=2048 Len=64
  199 4.204753800 192.168.1.20 → 24.20.126.47 TCP 150 1989 → 62537 [PSH, ACK] Seq=4225 Ack=2945 Win=337 Len=96
  200 4.206958904 24.20.126.47 → 192.168.1.20 TCP 118 62537 → 1989 [PSH, ACK] Seq=2945 Ack=4321 Win=2048 Len=64
  201 4.207793200 192.168.1.20 → 24.20.126.47 TCP 150 1989 → 62537 [PSH, ACK] Seq=4321 Ack=3009 Win=337 Len=96
  202 4.215900895 24.20.126.47 → 192.168.1.20 TCP 118 62537 → 1989 [PSH, ACK] Seq=3009 Ack=4417 Win=2047 Len=64
  203 4.216903238 192.168.1.20 → 24.20.126.47 TCP 150 1989 → 62537 [PSH, ACK] Seq=4417 Ack=3073 Win=337 Len=96
  204 4.257572598 24.20.126.47 → 192.168.1.20 TCP 60 62537 → 1989 [ACK] Seq=3073 Ack=4513 Win=2047 Len=0
  205 4.260901641 24.20.126.47 → 192.168.1.20 TCP 118 62537 → 1989 [PSH, ACK] Seq=3073 Ack=4513 Win=2047 Len=64
  206 4.261948939 192.168.1.20 → 24.20.126.47 TCP 150 1989 → 62537 [PSH, ACK] Seq=4513 Ack=3137 Win=337 Len=96
  207 4.270127995 24.20.126.47 → 192.168.1.20 TCP 118 62537 → 1989 [PSH, ACK] Seq=3137 Ack=4609 Win=2053 Len=64
  208 4.271158260 192.168.1.20 → 24.20.126.47 TCP 150 1989 → 62537 [PSH, ACK] Seq=4609 Ack=3201 Win=337 Len=96
  209 4.298470484 24.20.126.47 → 192.168.1.20 TCP 118 62537 → 1989 [PSH, ACK] Seq=3201 Ack=4705 Win=2052 Len=64
  210 4.299504588 192.168.1.20 → 24.20.126.47 TCP 150 1989 → 62537 [PSH, ACK] Seq=4705 Ack=3265 Win=337 Len=96
  211 4.340151343 24.20.126.47 → 192.168.1.20 TCP 60 62537 → 1989 [ACK] Seq=3265 Ack=4801 Win=2052 Len=0
  212 4.794386291 24.20.126.47 → 192.168.1.20 TCP 118 62537 → 1989 [PSH, ACK] Seq=3265 Ack=4801 Win=2052 Len=64
  213 4.795385552 192.168.1.20 → 24.20.126.47 TCP 150 1989 → 62537 [PSH, ACK] Seq=4801 Ack=3329 Win=337 Len=96
  214 4.833976386 192.168.1.20 → 192.168.1.3  ALLJOYN 231 Message 0000000825: 'Signal emission' Chat (s)
  215 4.834365090 192.168.1.20 → 192.168.1.3  UDP 231 37388 → 59146 Len=189
  216 4.834719499 192.168.1.20 → 192.168.1.3  UDP 231 37388 → 48830 Len=189
  217 4.835037111 192.168.1.20 → 192.168.1.5  UDP 231 37388 → 60277 Len=189
  218 4.835383204 192.168.1.20 → 192.168.1.2  UDP 231 37388 → 38990 Len=189
  219 4.835745836 192.168.1.20 → 192.168.1.2  ALLJOYN 231 Message 0000000825: 'Signal emission' Chat (s)
  220 4.835871698 24.20.126.47 → 192.168.1.20 TCP 60 62537 → 1989 [ACK] Seq=3329 Ack=4897 Win=2052 Len=0
  221 4.836000082 192.168.1.20 → 192.168.1.4  UDP 231 37388 → 48618 Len=189
  222 4.836359204 192.168.1.20 → 192.168.1.4  ALLJOYN 231 Message 0000000825: 'Signal emission' Chat (s)
  223 4.836742030 192.168.1.20 → 192.168.1.5  ALLJOYN 231 Message 0000000825: 'Signal emission' Chat (s)
  224 4.945952873  192.168.1.4 → 192.168.1.20 UDP 78 48618 → 37388 Len=36
  225 4.946009959  192.168.1.4 → 192.168.1.20 ALLJOYN-ARDP 78 flags: ACK SEQ:   66301960 ACK: 3091433167
  226 4.946239069  192.168.1.5 → 192.168.1.20 UDP 78 60277 → 37388 Len=36
  227 4.946712474  192.168.1.2 → 192.168.1.20 UDP 78 38990 → 37388 Len=36
  228 4.946770111  192.168.1.2 → 192.168.1.20 ALLJOYN-ARDP 78 flags: ACK SEQ: 3553995387 ACK:   86648328
  229 4.951007398  192.168.1.3 → 192.168.1.20 UDP 78 48830 → 37388 Len=36
  230 4.951063124  192.168.1.3 → 192.168.1.20 ALLJOYN-ARDP 78 flags: ACK SEQ: 4239715854 ACK:  959778020
  231 4.951067822  192.168.1.3 → 192.168.1.20 UDP 78 59146 → 37388 Len=36
  232 4.956580832  192.168.1.5 → 192.168.1.20 ALLJOYN-ARDP 78 flags: ACK SEQ:  994254277 ACK: 1796320324
  233 5.066362349  192.168.1.3 → 192.168.1.20 UDP 78 59146 → 37388 Len=36
  234 5.066521316  192.168.1.5 → 192.168.1.20 UDP 78 60277 → 37388 Len=36
  235 5.067945001  192.168.1.2 → 192.168.1.20 UDP 78 38990 → 37388 Len=36
  236 5.079506697  192.168.1.3 → 192.168.1.20 UDP 78 48830 → 37388 Len=36
  237 5.090798650  192.168.1.4 → 192.168.1.20 UDP 78 48618 → 37388 Len=36
  238 5.092208571  192.168.1.7 → 224.0.0.251  MDNS 103 Standard query 0x0000 PTR _googlecast._tcp.local, "QM" question PTR _CA5E8412._sub._googlecast._tcp.local, "QM" question
  239 5.094280566 fe80::1080:5a6c:f071:7e63 → ff02::fb     MDNS 123 Standard query 0x0000 PTR _googlecast._tcp.local, "QM" question PTR _CA5E8412._sub._googlecast._tcp.local, "QM" question
  240 5.180639235  192.168.1.2 → 192.168.1.20 ALLJOYN-ARDP 78 flags: ACK SEQ: 3553995387 ACK:   86648328
  241 5.237161524  192.168.1.5 → 192.168.1.20 ALLJOYN-ARDP 78 flags: ACK SEQ:  994254277 ACK: 1796320324
  242 5.260906213  192.168.1.3 → 192.168.1.20 ALLJOYN-ARDP 78 flags: ACK SEQ: 4239715854 ACK:  959778020
  243 5.287086613  192.168.1.4 → 192.168.1.20 ALLJOYN-ARDP 78 flags: ACK SEQ:   66301960 ACK: 3091433167
  244 5.291391796 24.20.126.47 → 192.168.1.20 TCP 118 62537 → 1989 [PSH, ACK] Seq=3329 Ack=4897 Win=2052 Len=64
  245 5.292458481 192.168.1.20 → 24.20.126.47 TCP 150 1989 → 62537 [PSH, ACK] Seq=4897 Ack=3393 Win=337 Len=96
  246 5.311869585 24.20.126.47 → 192.168.1.20 TCP 118 62537 → 1989 [PSH, ACK] Seq=3393 Ack=4993 Win=2051 Len=64
  247 5.312885955 192.168.1.20 → 24.20.126.47 TCP 150 1989 → 62537 [PSH, ACK] Seq=4993 Ack=3457 Win=337 Len=96
  248 5.339465558 24.20.126.47 → 192.168.1.20 TCP 118 62537 → 1989 [PSH, ACK] Seq=3457 Ack=5089 Win=2051 Len=64
  249 5.340471820 192.168.1.20 → 24.20.126.47 TCP 150 1989 → 62537 [PSH, ACK] Seq=5089 Ack=3521 Win=337 Len=96
  250 5.380519499 24.20.126.47 → 192.168.1.20 TCP 60 62537 → 1989 [ACK] Seq=3521 Ack=5185 Win=2050 Len=0
  251 5.383836810 24.20.126.47 → 192.168.1.20 TCP 118 62537 → 1989 [PSH, ACK] Seq=3521 Ack=5185 Win=2050 Len=64
  252 5.384846529 192.168.1.20 → 24.20.126.47 TCP 150 1989 → 62537 [PSH, ACK] Seq=5185 Ack=3585 Win=337 Len=96
  253 5.425281006 24.20.126.47 → 192.168.1.20 TCP 118 62537 → 1989 [PSH, ACK] Seq=3585 Ack=5281 Win=2050 Len=64
  254 5.426293592 192.168.1.20 → 24.20.126.47 TCP 150 1989 → 62537 [PSH, ACK] Seq=5281 Ack=3649 Win=337 Len=96
  255 5.432875022 24.20.126.47 → 192.168.1.20 TCP 118 62537 → 1989 [PSH, ACK] Seq=3649 Ack=5377 Win=2050 Len=64
  256 5.433942381 192.168.1.20 → 24.20.126.47 TCP 150 1989 → 62537 [PSH, ACK] Seq=5377 Ack=3713 Win=337 Len=96
  257 5.475449360 24.20.126.47 → 192.168.1.20 TCP 60 62537 → 1989 [ACK] Seq=3713 Ack=5473 Win=2049 Len=0
  258 5.579660242 24.20.126.47 → 192.168.1.20 TCP 118 62537 → 1989 [PSH, ACK] Seq=3713 Ack=5473 Win=2049 Len=64
  259 5.580690382 192.168.1.20 → 24.20.126.47 TCP 150 1989 → 62537 [PSH, ACK] Seq=5473 Ack=3777 Win=337 Len=96
  260 5.598525433 24.20.126.47 → 192.168.1.20 TCP 118 62537 → 1989 [PSH, ACK] Seq=3777 Ack=5569 Win=2049 Len=64
  261 5.599544580 192.168.1.20 → 24.20.126.47 TCP 150 1989 → 62537 [PSH, ACK] Seq=5569 Ack=3841 Win=337 Len=96
  262 5.626613325 24.20.126.47 → 192.168.1.20 TCP 118 62537 → 1989 [PSH, ACK] Seq=3841 Ack=5665 Win=2049 Len=64
  263 5.627632268 192.168.1.20 → 24.20.126.47 TCP 150 1989 → 62537 [PSH, ACK] Seq=5665 Ack=3905 Win=337 Len=96
  264 5.660940431 24.20.126.47 → 192.168.1.20 TCP 118 62537 → 1989 [PSH, ACK] Seq=3905 Ack=5761 Win=2048 Len=64
  265 5.661010931 24.20.126.47 → 192.168.1.20 TCP 118 62537 → 1989 [PSH, ACK] Seq=3969 Ack=5761 Win=2048 Len=64
  266 5.661176016 192.168.1.20 → 24.20.126.47 TCP 54 1989 → 62537 [ACK] Seq=5761 Ack=4033 Win=337 Len=0
  267 5.662084086 192.168.1.20 → 24.20.126.47 TCP 150 1989 → 62537 [PSH, ACK] Seq=5761 Ack=4033 Win=337 Len=96
  268 5.688283969 24.20.126.47 → 192.168.1.20 TCP 118 62537 → 1989 [PSH, ACK] Seq=4033 Ack=5857 Win=2048 Len=64
  269 5.689255667 192.168.1.20 → 24.20.126.47 TCP 150 1989 → 62537 [PSH, ACK] Seq=5857 Ack=4097 Win=337 Len=96
  270 5.730079322 24.20.126.47 → 192.168.1.20 TCP 60 62537 → 1989 [ACK] Seq=4097 Ack=5953 Win=2047 Len=0
  271 6.142711399 24.20.126.47 → 192.168.1.20 TCP 118 62537 → 1989 [PSH, ACK] Seq=4097 Ack=5953 Win=2047 Len=64
  272 6.143691248 192.168.1.20 → 24.20.126.47 TCP 150 1989 → 62537 [PSH, ACK] Seq=5953 Ack=4161 Win=337 Len=96
  273 6.181215400 192.168.1.20 → 192.168.1.3  ALLJOYN 231 Message 0000000826: 'Signal emission' Chat (s)
  274 6.181547240 192.168.1.20 → 192.168.1.3  UDP 231 37388 → 59146 Len=189
  275 6.181897626 192.168.1.20 → 192.168.1.3  UDP 231 37388 → 48830 Len=189
  276 6.182224762 192.168.1.20 → 192.168.1.5  UDP 231 37388 → 60277 Len=189
  277 6.182581154 192.168.1.20 → 192.168.1.2  UDP 231 37388 → 38990 Len=189
  278 6.182906328 192.168.1.20 → 192.168.1.2  ALLJOYN 231 Message 0000000826: 'Signal emission' Chat (s)
  279 6.183247526 192.168.1.20 → 192.168.1.4  UDP 231 37388 → 48618 Len=189
  280 6.183576313 192.168.1.20 → 192.168.1.4  ALLJOYN 231 Message 0000000826: 'Signal emission' Chat (s)
  281 6.183911101 192.168.1.20 → 192.168.1.5  ALLJOYN 231 Message 0000000826: 'Signal emission' Chat (s)
  282 6.184942638 24.20.126.47 → 192.168.1.20 TCP 60 62537 → 1989 [ACK] Seq=4161 Ack=6049 Win=2047 Len=0
  283 6.291766565  192.168.1.5 → 192.168.1.20 ALLJOYN-ARDP 78 flags: ACK SEQ:  994254277 ACK: 1796320325
  284 6.291828873  192.168.1.5 → 192.168.1.20 UDP 78 60277 → 37388 Len=36
  285 6.291883995  192.168.1.3 → 192.168.1.20 UDP 78 48830 → 37388 Len=36
  286 6.291896012  192.168.1.3 → 192.168.1.20 ALLJOYN-ARDP 78 flags: ACK SEQ: 4239715854 ACK:  959778021
  287 6.292387124  192.168.1.4 → 192.168.1.20 ALLJOYN-ARDP 78 flags: ACK SEQ:   66301960 ACK: 3091433168
  288 6.292401024  192.168.1.4 → 192.168.1.20 UDP 78 48618 → 37388 Len=36
  289 6.293653957  192.168.1.2 → 192.168.1.20 UDP 78 38990 → 37388 Len=36
  290 6.293690483  192.168.1.2 → 192.168.1.20 ALLJOYN-ARDP 78 flags: ACK SEQ: 3553995387 ACK:   86648329
  291 6.300631189  192.168.1.3 → 192.168.1.20 UDP 78 59146 → 37388 Len=36
  292 6.394941021  192.168.1.2 → 192.168.1.20 UDP 78 38990 → 37388 Len=36
  293 6.405685509  192.168.1.5 → 192.168.1.20 UDP 78 60277 → 37388 Len=36
  294 6.418587763  192.168.1.4 → 192.168.1.20 UDP 78 48618 → 37388 Len=36
  295 6.478908608  192.168.1.3 → 192.168.1.20 UDP 78 48830 → 37388 Len=36
  296 6.479110881  192.168.1.2 → 192.168.1.20 ALLJOYN-ARDP 78 flags: ACK SEQ: 3553995387 ACK:   86648329
  297 6.557804600  192.168.1.5 → 192.168.1.20 ALLJOYN-ARDP 78 flags: ACK SEQ:  994254277 ACK: 1796320325
  298 6.580528471  192.168.1.3 → 192.168.1.20 ALLJOYN-ARDP 78 flags: ACK SEQ: 4239715854 ACK:  959778021
  299 6.619693061  192.168.1.4 → 192.168.1.20 ALLJOYN-ARDP 78 flags: ACK SEQ:   66301960 ACK: 3091433168
  300 7.183142438 192.168.1.20 → 24.20.126.47 TCP 230 1989 → 62537 [PSH, ACK] Seq=6049 Ack=4161 Win=337 Len=176
  301 7.223838722 24.20.126.47 → 192.168.1.20 TCP 60 62537 → 1989 [ACK] Seq=4161 Ack=6225 Win=2053 Len=0
  302 8.312494629  192.168.1.2 → 192.168.1.20 UDP 250 55713 → 58942 Len=208
  303 8.316165573 192.168.1.20 → 192.168.1.2  UDP 493 58942 → 55713 Len=451
  304 8.318956169 192.168.1.20 → 192.168.1.2  UDP 493 58942 → 55713 Len=451
  305 8.862404703 24.20.126.47 → 192.168.1.20 TCP 118 62537 → 1989 [PSH, ACK] Seq=4161 Ack=6225 Win=2053 Len=64
  306 8.901132427 192.168.1.20 → 24.20.126.47 TCP 54 1989 → 62537 [ACK] Seq=6225 Ack=4225 Win=337 Len=0
